[NbConvertApp] WARNING | Config option `kernel_spec_manager_class` not recognized by `NbConvertApp`.
[NbConvertApp] Converting notebook ../notebooks/Hyperparameter_Optimization_model_binary.ipynb to script
[NbConvertApp] Writing 8579 bytes to Hyperparameter_Optimization_model_binary.py
cell_type: SHSY5Y control_name: LPS_Nigericin_1.000_10.0_DMSO_0.025 treatment_name: H2O2_100.000_DMSO_0.025
[I 2023-09-17 20:38:10,027] A new study created in memory with name: no-name-9a650bac-9430-4da9-b01d-e282ee64c2da
[I 2023-09-17 20:38:22,377] Trial 0 finished with value: 0.23634785544127226 and parameters: {'n_layers': 1, 'n_units_l0': 5, 'dropout_0': 0.25976755885931846, 'learning_rate': 0.04865818652764869, 'optimizer': 'SGD'}. Best is trial 0 with value: 0.23634785544127226.
[I 2023-09-17 20:38:35,637] Trial 1 finished with value: 0.11857166692614556 and parameters: {'n_layers': 3, 'n_units_l0': 7, 'dropout_0': 0.11266451085227105, 'n_units_l1': 5, 'dropout_1': 0.3226245735819621, 'n_units_l2': 7, 'dropout_2': 0.39241700211119346, 'learning_rate': 0.06190998542921801, 'optimizer': 'Adam'}. Best is trial 1 with value: 0.11857166692614556.
[I 2023-09-17 20:38:47,980] Trial 2 finished with value: 0.1716592490673065 and parameters: {'n_layers': 2, 'n_units_l0': 5, 'dropout_0': 0.20284552066753575, 'n_units_l1': 3, 'dropout_1': 0.2363315378692402, 'learning_rate': 0.05413653197962081, 'optimizer': 'SGD'}. Best is trial 1 with value: 0.11857166692614556.
[I 2023-09-17 20:39:00,937] Trial 3 finished with value: 0.1384171622246504 and parameters: {'n_layers': 2, 'n_units_l0': 10, 'dropout_0': 0.2675189778362757, 'n_units_l1': 9, 'dropout_1': 0.17382801013978733, 'learning_rate': 0.04216645015499106, 'optimizer': 'Adam'}. Best is trial 1 with value: 0.11857166692614556.
[I 2023-09-17 20:39:13,517] Trial 4 finished with value: 0.1893092603608966 and parameters: {'n_layers': 2, 'n_units_l0': 2, 'dropout_0': 0.18455965069586933, 'n_units_l1': 6, 'dropout_1': 0.15408137840754696, 'learning_rate': 0.02077536917928976, 'optimizer': 'Adam'}. Best is trial 1 with value: 0.11857166692614556.
[I 2023-09-17 20:39:13,833] Trial 5 pruned.
[I 2023-09-17 20:39:26,730] Trial 6 finished with value: 0.1153333405405283 and parameters: {'n_layers': 2, 'n_units_l0': 10, 'dropout_0': 0.2045016984200105, 'n_units_l1': 2, 'dropout_1': 0.17404257192513733, 'learning_rate': 0.08472709154745506, 'optimizer': 'Adam'}. Best is trial 6 with value: 0.1153333405405283.
[I 2023-09-17 20:39:26,955] Trial 7 pruned.
[I 2023-09-17 20:39:27,276] Trial 8 pruned.
[I 2023-09-17 20:39:40,362] Trial 9 finished with value: 0.10517053058370948 and parameters: {'n_layers': 3, 'n_units_l0': 8, 'dropout_0': 0.2794686428282192, 'n_units_l1': 6, 'dropout_1': 0.2632782675580212, 'n_units_l2': 2, 'dropout_2': 0.32896934383497023, 'learning_rate': 0.037435037514506754, 'optimizer': 'Adam'}. Best is trial 9 with value: 0.10517053058370948.
Selected Catagories are:
['H2O2_100.000_DMSO_0.025' 'LPS_Nigericin_1.000_10.0_DMSO_0.025']
The dimensions of the data are: (41302, 1276)
Number of total missing values across all columns: 53800
Data Subset Is Off
Wells held out for testing: ['H22' 'M16']
Wells to use for training, validation, and testing ['H18' 'H19' 'H23' 'M17' 'I18' 'I19' 'M20' 'M21' 'I22' 'I23']
Number of in features:  1251
Number of out features:  2
Binary_Classification
cpu
Validation Accuracy: 95.32010820559063
Validation Loss: 0.208645476475358
Training Accuracy: 87.78699736941
Training Loss: 0.2682334308271055
completed
