[NbConvertApp] WARNING | Config option `kernel_spec_manager_class` not recognized by `NbConvertApp`.
[NbConvertApp] Converting notebook ../notebooks/Hyperparameter_Optimization_model_binary.ipynb to script
[NbConvertApp] Writing 8579 bytes to Hyperparameter_Optimization_model_binary.py
cell_type: PBMC control_name: Thapsigargin_10.000_DMSO_0.025 treatment_name: LPS_10.000_DMSO_0.025
[I 2023-09-19 01:15:00,294] A new study created in memory with name: no-name-e1064298-d6ca-490b-9aea-903ffc72138f
[I 2023-09-19 01:16:27,659] Trial 0 finished with value: 0.2523533174643914 and parameters: {'n_layers': 1, 'n_units_l0': 7, 'dropout_0': 0.10930147105785837, 'learning_rate': 0.04953337141749982, 'optimizer': 'Adam'}. Best is trial 0 with value: 0.2523533174643914.
[I 2023-09-19 01:17:56,200] Trial 1 finished with value: 0.46146452506383256 and parameters: {'n_layers': 2, 'n_units_l0': 2, 'dropout_0': 0.3767775272676811, 'n_units_l1': 8, 'dropout_1': 0.22965236823452823, 'learning_rate': 0.06427669457956764, 'optimizer': 'Adam'}. Best is trial 0 with value: 0.2523533174643914.
[I 2023-09-19 01:19:22,704] Trial 2 finished with value: 0.29396189200381434 and parameters: {'n_layers': 1, 'n_units_l0': 8, 'dropout_0': 0.32591738625845174, 'learning_rate': 0.02425060950359406, 'optimizer': 'RMSprop'}. Best is trial 0 with value: 0.2523533174643914.
[I 2023-09-19 01:20:52,609] Trial 3 finished with value: 0.5029010565082231 and parameters: {'n_layers': 3, 'n_units_l0': 2, 'dropout_0': 0.36302631491445314, 'n_units_l1': 5, 'dropout_1': 0.3016736641212773, 'n_units_l2': 4, 'dropout_2': 0.310301891646235, 'learning_rate': 0.046206896697322815, 'optimizer': 'Adam'}. Best is trial 0 with value: 0.2523533174643914.
[I 2023-09-19 01:22:19,582] Trial 4 finished with value: 0.32274864438921214 and parameters: {'n_layers': 2, 'n_units_l0': 6, 'dropout_0': 0.22913729759458804, 'n_units_l1': 8, 'dropout_1': 0.36423732821152555, 'learning_rate': 0.02596910304980727, 'optimizer': 'RMSprop'}. Best is trial 0 with value: 0.2523533174643914.
[I 2023-09-19 01:22:21,352] Trial 5 pruned.
[I 2023-09-19 01:22:23,088] Trial 6 pruned.
[I 2023-09-19 01:22:35,399] Trial 7 pruned.
[I 2023-09-19 01:22:48,070] Trial 8 pruned.
[I 2023-09-19 01:22:49,820] Trial 9 pruned.
Selected Catagories are:
['LPS_10.000_DMSO_0.025' 'Thapsigargin_10.000_DMSO_0.025']
The dimensions of the data are: (323474, 1270)
Number of total missing values across all columns: 646948
Data Subset Is Off
Wells held out for testing: ['E09' 'L06']
Wells to use for training, validation, and testing ['E02' 'E03' 'E06' 'E07' 'E08' 'L07']
Number of in features:  1245
Number of out features:  2
Binary_Classification
cpu
Validation Accuracy: 89.33043954654642
Validation Loss: 0.2564567254111171
Training Accuracy: 88.3990981309396
Training Loss: 0.2664800043576642
completed
