[NbConvertApp] WARNING | Config option `kernel_spec_manager_class` not recognized by `NbConvertApp`.
[NbConvertApp] Converting notebook ../notebooks/Hyperparameter_Optimization_model_binary.ipynb to script
[NbConvertApp] Writing 8579 bytes to Hyperparameter_Optimization_model_binary.py
cell_type: SHSY5Y control_name: H2O2_100.000_DMSO_0.025 treatment_name: Thapsigargin_10.000_DMSO_0.025
[I 2023-09-17 20:32:13,844] A new study created in memory with name: no-name-62b5777f-0aaf-4fdd-a46b-0567ec155929
[I 2023-09-17 20:32:25,084] Trial 0 finished with value: 0.26841607920825483 and parameters: {'n_layers': 2, 'n_units_l0': 6, 'dropout_0': 0.19138487917538527, 'n_units_l1': 4, 'dropout_1': 0.21853894706437332, 'learning_rate': 0.07060331663921154, 'optimizer': 'Adam'}. Best is trial 0 with value: 0.26841607920825483.
[I 2023-09-17 20:32:35,824] Trial 1 finished with value: 0.17872879184782506 and parameters: {'n_layers': 2, 'n_units_l0': 7, 'dropout_0': 0.274558191407328, 'n_units_l1': 5, 'dropout_1': 0.20058155272667538, 'learning_rate': 0.09263578468266649, 'optimizer': 'SGD'}. Best is trial 1 with value: 0.17872879184782506.
[I 2023-09-17 20:32:47,003] Trial 2 finished with value: 0.5201160320639611 and parameters: {'n_layers': 3, 'n_units_l0': 8, 'dropout_0': 0.3266912129637797, 'n_units_l1': 6, 'dropout_1': 0.3032579652711441, 'n_units_l2': 4, 'dropout_2': 0.2938563663524217, 'learning_rate': 0.07932329121714385, 'optimizer': 'RMSprop'}. Best is trial 1 with value: 0.17872879184782506.
[I 2023-09-17 20:32:58,173] Trial 3 finished with value: 0.28867852851748466 and parameters: {'n_layers': 3, 'n_units_l0': 7, 'dropout_0': 0.38615705047392823, 'n_units_l1': 10, 'dropout_1': 0.1844276238877039, 'n_units_l2': 3, 'dropout_2': 0.3151514063867695, 'learning_rate': 0.04282748231945566, 'optimizer': 'SGD'}. Best is trial 1 with value: 0.17872879184782506.
[I 2023-09-17 20:33:08,851] Trial 4 finished with value: 0.18751410163939 and parameters: {'n_layers': 1, 'n_units_l0': 6, 'dropout_0': 0.3616512434053204, 'learning_rate': 0.07694568895391689, 'optimizer': 'Adam'}. Best is trial 1 with value: 0.17872879184782506.
[I 2023-09-17 20:33:09,128] Trial 5 pruned.
[I 2023-09-17 20:33:09,319] Trial 6 pruned.
[I 2023-09-17 20:33:19,807] Trial 7 finished with value: 0.21466297544538976 and parameters: {'n_layers': 1, 'n_units_l0': 5, 'dropout_0': 0.15454965270773097, 'learning_rate': 0.017655135062564893, 'optimizer': 'RMSprop'}. Best is trial 1 with value: 0.17872879184782506.
[I 2023-09-17 20:33:20,002] Trial 8 pruned.
[I 2023-09-17 20:33:20,473] Trial 9 pruned.
Selected Catagories are:
['Thapsigargin_10.000_DMSO_0.025' 'H2O2_100.000_DMSO_0.025']
The dimensions of the data are: (40112, 1276)
Number of total missing values across all columns: 80224
Data Subset Is Off
Wells held out for testing: ['E14' 'H22']
Wells to use for training, validation, and testing ['E15' 'H18' 'H19' 'H23' 'L14' 'L15' 'I18' 'I19' 'I22' 'I23']
Number of in features:  1251
Number of out features:  2
Binary_Classification
cpu
Validation Accuracy: 93.28641671788567
Validation Loss: 0.19404494345188142
Training Accuracy: 90.68505994466646
Training Loss: 0.22789565578792936
completed
