[NbConvertApp] WARNING | Config option `kernel_spec_manager_class` not recognized by `NbConvertApp`.
[NbConvertApp] Converting notebook ../notebooks/Hyperparameter_Optimization_model_binary.ipynb to script
[NbConvertApp] Writing 8579 bytes to Hyperparameter_Optimization_model_binary.py
cell_type: SHSY5Y control_name: LPS_100.000_DMSO_0.025 treatment_name: DMSO_0.100_DMSO_0.025
[I 2023-09-17 19:24:53,503] A new study created in memory with name: no-name-8ef03785-5314-4464-922b-051887ddb9a6
[I 2023-09-17 19:25:21,142] Trial 0 finished with value: 0.19394602769613264 and parameters: {'n_layers': 3, 'n_units_l0': 3, 'dropout_0': 0.15644230317535548, 'n_units_l1': 6, 'dropout_1': 0.38759775407737096, 'n_units_l2': 6, 'dropout_2': 0.35251956818426267, 'learning_rate': 0.0704444445328486, 'optimizer': 'SGD'}. Best is trial 0 with value: 0.19394602769613264.
[I 2023-09-17 19:25:46,442] Trial 1 finished with value: 0.27088690650463104 and parameters: {'n_layers': 1, 'n_units_l0': 5, 'dropout_0': 0.21795337754826927, 'learning_rate': 0.07343415122885631, 'optimizer': 'RMSprop'}. Best is trial 0 with value: 0.19394602769613264.
[I 2023-09-17 19:26:06,869] Trial 2 finished with value: 0.23733707907795903 and parameters: {'n_layers': 2, 'n_units_l0': 3, 'dropout_0': 0.15599964361100568, 'n_units_l1': 4, 'dropout_1': 0.12555383169762, 'learning_rate': 0.07405342392708239, 'optimizer': 'SGD'}. Best is trial 0 with value: 0.19394602769613264.
[I 2023-09-17 19:26:28,568] Trial 3 finished with value: 0.1829084021449089 and parameters: {'n_layers': 3, 'n_units_l0': 6, 'dropout_0': 0.19582259022903892, 'n_units_l1': 3, 'dropout_1': 0.12408316296077818, 'n_units_l2': 4, 'dropout_2': 0.18152757354743762, 'learning_rate': 0.05421686429884939, 'optimizer': 'Adam'}. Best is trial 3 with value: 0.1829084021449089.
[I 2023-09-17 19:26:48,686] Trial 4 finished with value: 0.22164286726713178 and parameters: {'n_layers': 3, 'n_units_l0': 3, 'dropout_0': 0.38398902769443133, 'n_units_l1': 7, 'dropout_1': 0.3070788480629788, 'n_units_l2': 9, 'dropout_2': 0.3139842002598506, 'learning_rate': 0.01831902868903128, 'optimizer': 'Adam'}. Best is trial 3 with value: 0.1829084021449089.
[I 2023-09-17 19:27:06,868] Trial 5 finished with value: 0.17827233356237415 and parameters: {'n_layers': 2, 'n_units_l0': 4, 'dropout_0': 0.18307555056937022, 'n_units_l1': 9, 'dropout_1': 0.15314142244060974, 'learning_rate': 0.05085895545186113, 'optimizer': 'Adam'}. Best is trial 5 with value: 0.17827233356237415.
[I 2023-09-17 19:27:07,245] Trial 6 pruned.
[I 2023-09-17 19:27:07,727] Trial 7 pruned.
[I 2023-09-17 19:27:08,071] Trial 8 pruned.
[I 2023-09-17 19:27:08,453] Trial 9 pruned.
Selected Catagories are:
['DMSO_0.100_DMSO_0.025' 'LPS_100.000_DMSO_0.025']
The dimensions of the data are: (51630, 1276)
Number of total missing values across all columns: 103260
Data Subset Is Off
Wells held out for testing: ['I14' 'J21']
Wells to use for training, validation, and testing ['B14' 'C14' 'B15' 'C15' 'J14' 'I15' 'J15' 'J16' 'J17' 'J20']
Number of in features:  1251
Number of out features:  2
Binary_Classification
cpu
Validation Accuracy: 95.61940473400514
Validation Loss: 0.13463555619120599
Training Accuracy: 94.728737585328
Training Loss: 0.13563262317968267
completed
