[NbConvertApp] WARNING | Config option `kernel_spec_manager_class` not recognized by `NbConvertApp`.
[NbConvertApp] Converting notebook ../notebooks/Hyperparameter_Optimization_model_binary.ipynb to script
[NbConvertApp] Writing 8579 bytes to Hyperparameter_Optimization_model_binary.py
cell_type: PBMC control_name: LPS_Nigericin_1.000_1.0_DMSO_0.025 treatment_name: LPS_Nigericin_1.000_3.0_DMSO_0.025
[I 2023-09-17 19:59:14,385] A new study created in memory with name: no-name-57800e2c-a90e-4488-af31-8eeb1e2ea6a0
[I 2023-09-17 20:00:44,695] Trial 0 finished with value: 0.5686060609640898 and parameters: {'n_layers': 1, 'n_units_l0': 3, 'dropout_0': 0.3352995565038399, 'learning_rate': 0.06325446063826551, 'optimizer': 'Adam'}. Best is trial 0 with value: 0.5686060609640898.
[I 2023-09-17 20:02:15,023] Trial 1 finished with value: 0.5799092942255515 and parameters: {'n_layers': 1, 'n_units_l0': 10, 'dropout_0': 0.36427702695775566, 'learning_rate': 0.003930029537493968, 'optimizer': 'SGD'}. Best is trial 0 with value: 0.5686060609640898.
[I 2023-09-17 20:03:45,993] Trial 2 finished with value: 0.509556320420018 and parameters: {'n_layers': 1, 'n_units_l0': 9, 'dropout_0': 0.3460913986625763, 'learning_rate': 0.03620116452214096, 'optimizer': 'Adam'}. Best is trial 2 with value: 0.509556320420018.
[I 2023-09-17 20:05:15,651] Trial 3 finished with value: 0.7010470144836991 and parameters: {'n_layers': 1, 'n_units_l0': 4, 'dropout_0': 0.3308778244996583, 'learning_rate': 0.09567858104756646, 'optimizer': 'RMSprop'}. Best is trial 2 with value: 0.509556320420018.
[I 2023-09-17 20:06:45,461] Trial 4 finished with value: 0.6795382957546799 and parameters: {'n_layers': 2, 'n_units_l0': 5, 'dropout_0': 0.19912458232123686, 'n_units_l1': 5, 'dropout_1': 0.15186006901461716, 'learning_rate': 0.002399163959335064, 'optimizer': 'SGD'}. Best is trial 2 with value: 0.509556320420018.
[I 2023-09-17 20:08:19,493] Trial 5 finished with value: 0.5110597538285786 and parameters: {'n_layers': 3, 'n_units_l0': 10, 'dropout_0': 0.2908606876303954, 'n_units_l1': 6, 'dropout_1': 0.19397877167149397, 'n_units_l2': 9, 'dropout_2': 0.3742197858510006, 'learning_rate': 0.09621701912991408, 'optimizer': 'SGD'}. Best is trial 2 with value: 0.509556320420018.
[I 2023-09-17 20:09:49,059] Trial 6 finished with value: 0.5167729629631396 and parameters: {'n_layers': 1, 'n_units_l0': 5, 'dropout_0': 0.2513746550071757, 'learning_rate': 0.05766575776038882, 'optimizer': 'Adam'}. Best is trial 2 with value: 0.509556320420018.
[I 2023-09-17 20:09:50,871] Trial 7 pruned.
[I 2023-09-17 20:11:26,248] Trial 8 finished with value: 0.5332502679030101 and parameters: {'n_layers': 3, 'n_units_l0': 8, 'dropout_0': 0.19334170728717281, 'n_units_l1': 2, 'dropout_1': 0.19248307272211973, 'n_units_l2': 4, 'dropout_2': 0.330560160636592, 'learning_rate': 0.011828152299142703, 'optimizer': 'Adam'}. Best is trial 2 with value: 0.509556320420018.
[I 2023-09-17 20:11:43,228] Trial 9 pruned.
Selected Catagories are:
['LPS_Nigericin_1.000_1.0_DMSO_0.025' 'LPS_Nigericin_1.000_3.0_DMSO_0.025']
The dimensions of the data are: (340274, 1270)
Number of total missing values across all columns: 0
Data Subset Is Off
Wells held out for testing: ['K08' 'L09']
Wells to use for training, validation, and testing ['K02' 'K03' 'K09' 'L02' 'L03' 'L08']
Number of in features:  1245
Number of out features:  2
Binary_Classification
cpu
Validation Accuracy: 73.88792609840823
Validation Loss: 0.5114784053078405
Training Accuracy: 72.0465242785158
Training Loss: 0.5305143196781477
completed
