[NbConvertApp] WARNING | Config option `kernel_spec_manager_class` not recognized by `NbConvertApp`.
[NbConvertApp] Converting notebook ../notebooks/Hyperparameter_Optimization_model_binary.ipynb to script
[NbConvertApp] Writing 8579 bytes to Hyperparameter_Optimization_model_binary.py
cell_type: SHSY5Y control_name: Flagellin_1.000_DMSO_0.025 treatment_name: Thapsigargin_1.000_DMSO_0.025
[I 2023-09-17 20:33:00,941] A new study created in memory with name: no-name-def921cb-20df-420e-9f4f-821da7dcbb1e
[I 2023-09-17 20:33:09,802] Trial 0 finished with value: 0.3047925354043642 and parameters: {'n_layers': 1, 'n_units_l0': 3, 'dropout_0': 0.29843372847539684, 'learning_rate': 0.041833883175458816, 'optimizer': 'RMSprop'}. Best is trial 0 with value: 0.3047925354043642.
[I 2023-09-17 20:33:18,488] Trial 1 finished with value: 0.31247466266155244 and parameters: {'n_layers': 1, 'n_units_l0': 2, 'dropout_0': 0.1758364124321917, 'learning_rate': 0.05195629313529013, 'optimizer': 'SGD'}. Best is trial 0 with value: 0.3047925354043642.
[I 2023-09-17 20:33:27,645] Trial 2 finished with value: 0.5673911821842194 and parameters: {'n_layers': 3, 'n_units_l0': 3, 'dropout_0': 0.17006966462777745, 'n_units_l1': 8, 'dropout_1': 0.14734022005986602, 'n_units_l2': 3, 'dropout_2': 0.2621864416908996, 'learning_rate': 0.02810471951354795, 'optimizer': 'SGD'}. Best is trial 0 with value: 0.3047925354043642.
[I 2023-09-17 20:33:36,464] Trial 3 finished with value: 0.37039713323116297 and parameters: {'n_layers': 1, 'n_units_l0': 8, 'dropout_0': 0.18646234531361622, 'learning_rate': 0.06337028999343607, 'optimizer': 'Adam'}. Best is trial 0 with value: 0.3047925354043642.
[I 2023-09-17 20:33:45,500] Trial 4 finished with value: 0.45629418969154356 and parameters: {'n_layers': 3, 'n_units_l0': 3, 'dropout_0': 0.34188556388104685, 'n_units_l1': 3, 'dropout_1': 0.19773021787243844, 'n_units_l2': 3, 'dropout_2': 0.36579598307683625, 'learning_rate': 0.051706603766133626, 'optimizer': 'SGD'}. Best is trial 0 with value: 0.3047925354043642.
[I 2023-09-17 20:33:45,666] Trial 5 pruned.
[I 2023-09-17 20:33:45,831] Trial 6 pruned.
[I 2023-09-17 20:33:48,451] Trial 7 pruned.
[I 2023-09-17 20:33:53,924] Trial 8 pruned.
[I 2023-09-17 20:33:54,180] Trial 9 pruned.
Selected Catagories are:
['Thapsigargin_1.000_DMSO_0.025' 'Flagellin_1.000_DMSO_0.025']
The dimensions of the data are: (29575, 1276)
Number of total missing values across all columns: 59150
Data Subset Is Off
Wells held out for testing: ['D14' 'M22']
Wells to use for training, validation, and testing ['D15' 'K14' 'K15' 'M18' 'M19' 'M23']
Number of in features:  1251
Number of out features:  2
Binary_Classification
cpu
Validation Accuracy: 87.63611859838272
Validation Loss: 0.3276974066098531
Training Accuracy: 84.4094815480537
Training Loss: 0.33066668457455106
completed
