[NbConvertApp] WARNING | Config option `kernel_spec_manager_class` not recognized by `NbConvertApp`.
[NbConvertApp] Converting notebook ../notebooks/Hyperparameter_Optimization_model_binary.ipynb to script
[NbConvertApp] Writing 8579 bytes to Hyperparameter_Optimization_model_binary.py
cell_type: SHSY5Y control_name: Flagellin_1.000_DMSO_0.025 treatment_name: LPS_Nigericin_1.000_3.0_DMSO_0.025
[I 2023-09-19 00:54:36,700] A new study created in memory with name: no-name-61d4c9f0-7a23-4835-9519-52e217893b26
[I 2023-09-19 00:54:45,729] Trial 0 finished with value: 0.20654646183053654 and parameters: {'n_layers': 3, 'n_units_l0': 9, 'dropout_0': 0.36778771499183094, 'n_units_l1': 9, 'dropout_1': 0.13836103629001528, 'n_units_l2': 8, 'dropout_2': 0.25416399921394645, 'learning_rate': 0.05905056547658086, 'optimizer': 'SGD'}. Best is trial 0 with value: 0.20654646183053654.
[I 2023-09-19 00:54:54,186] Trial 1 finished with value: 0.20566794142127037 and parameters: {'n_layers': 1, 'n_units_l0': 6, 'dropout_0': 0.2930139406874894, 'learning_rate': 0.05088474713252001, 'optimizer': 'RMSprop'}. Best is trial 1 with value: 0.20566794142127037.
[I 2023-09-19 00:55:02,696] Trial 2 finished with value: 0.1761770498752594 and parameters: {'n_layers': 1, 'n_units_l0': 9, 'dropout_0': 0.23318608962058232, 'learning_rate': 0.0648054734766016, 'optimizer': 'Adam'}. Best is trial 2 with value: 0.1761770498752594.
[I 2023-09-19 00:55:11,494] Trial 3 finished with value: 0.18543203661839164 and parameters: {'n_layers': 2, 'n_units_l0': 9, 'dropout_0': 0.13931010168293995, 'n_units_l1': 6, 'dropout_1': 0.10357558751226352, 'learning_rate': 0.05610599641945021, 'optimizer': 'Adam'}. Best is trial 2 with value: 0.1761770498752594.
[I 2023-09-19 00:55:20,094] Trial 4 finished with value: 0.19371921519438423 and parameters: {'n_layers': 1, 'n_units_l0': 9, 'dropout_0': 0.10129290510200609, 'learning_rate': 0.04631826799910005, 'optimizer': 'Adam'}. Best is trial 2 with value: 0.1761770498752594.
[I 2023-09-19 00:55:20,337] Trial 5 pruned.
[I 2023-09-19 00:55:20,502] Trial 6 pruned.
[I 2023-09-19 00:55:20,660] Trial 7 pruned.
[I 2023-09-19 00:55:20,815] Trial 8 pruned.
[I 2023-09-19 00:55:20,973] Trial 9 pruned.
Selected Catagories are:
['LPS_Nigericin_1.000_3.0_DMSO_0.025' 'Flagellin_1.000_DMSO_0.025']
The dimensions of the data are: (29461, 1276)
Number of total missing values across all columns: 31618
Data Subset Is Off
Wells held out for testing: ['L16' 'M22']
Wells to use for training, validation, and testing ['L17' 'M18' 'M19' 'L20' 'L21' 'M23']
Number of in features:  1251
Number of out features:  2
Binary_Classification
cpu
Validation Accuracy: 94.14456721915285
Validation Loss: 0.17740846355756118
Training Accuracy: 94.64567382418974
Training Loss: 0.12065093779315551
completed
