[NbConvertApp] WARNING | Config option `kernel_spec_manager_class` not recognized by `NbConvertApp`.
[NbConvertApp] Converting notebook ../notebooks/Hyperparameter_Optimization_model_binary.ipynb to script
[NbConvertApp] Writing 8579 bytes to Hyperparameter_Optimization_model_binary.py
cell_type: SHSY5Y control_name: LPS_0.100_DMSO_0.025 treatment_name: DMSO_0.100_DMSO_0.025
[I 2023-09-17 19:25:11,089] A new study created in memory with name: no-name-9e56b1d8-0197-41b7-83ba-4f5d049b503a
[I 2023-09-17 19:25:26,139] Trial 0 finished with value: 0.5638328649997711 and parameters: {'n_layers': 2, 'n_units_l0': 4, 'dropout_0': 0.10725888648488958, 'n_units_l1': 2, 'dropout_1': 0.3828935557462948, 'learning_rate': 0.012326730049920399, 'optimizer': 'Adam'}. Best is trial 0 with value: 0.5638328649997711.
[I 2023-09-17 19:25:41,101] Trial 1 finished with value: 0.6069407012462615 and parameters: {'n_layers': 2, 'n_units_l0': 3, 'dropout_0': 0.19266963785042207, 'n_units_l1': 5, 'dropout_1': 0.3065122875335725, 'learning_rate': 0.057813804920924285, 'optimizer': 'Adam'}. Best is trial 0 with value: 0.5638328649997711.
[I 2023-09-17 19:25:55,867] Trial 2 finished with value: 0.6291579210758209 and parameters: {'n_layers': 3, 'n_units_l0': 6, 'dropout_0': 0.3421394465664086, 'n_units_l1': 2, 'dropout_1': 0.33118566862366006, 'n_units_l2': 5, 'dropout_2': 0.2637613503808327, 'learning_rate': 0.09448670462214193, 'optimizer': 'RMSprop'}. Best is trial 0 with value: 0.5638328649997711.
[I 2023-09-17 19:26:11,010] Trial 3 finished with value: 0.5929193437099457 and parameters: {'n_layers': 2, 'n_units_l0': 10, 'dropout_0': 0.10230339487135431, 'n_units_l1': 4, 'dropout_1': 0.13928507310359461, 'learning_rate': 0.0052703612731896, 'optimizer': 'Adam'}. Best is trial 0 with value: 0.5638328649997711.
[I 2023-09-17 19:26:25,101] Trial 4 finished with value: 0.6387917311191559 and parameters: {'n_layers': 1, 'n_units_l0': 4, 'dropout_0': 0.372168765552814, 'learning_rate': 0.026966201231326946, 'optimizer': 'RMSprop'}. Best is trial 0 with value: 0.5638328649997711.
[I 2023-09-17 19:26:25,347] Trial 5 pruned.
[I 2023-09-17 19:26:39,899] Trial 6 finished with value: 0.5680252056121826 and parameters: {'n_layers': 2, 'n_units_l0': 5, 'dropout_0': 0.28843366191005126, 'n_units_l1': 7, 'dropout_1': 0.11062264010212922, 'learning_rate': 0.03300799967200436, 'optimizer': 'Adam'}. Best is trial 0 with value: 0.5638328649997711.
[I 2023-09-17 19:26:53,929] Trial 7 finished with value: 0.5644049139022826 and parameters: {'n_layers': 1, 'n_units_l0': 8, 'dropout_0': 0.37327717679444483, 'learning_rate': 0.09263887138756258, 'optimizer': 'SGD'}. Best is trial 0 with value: 0.5638328649997711.
[I 2023-09-17 19:26:54,274] Trial 8 pruned.
[I 2023-09-17 19:27:08,585] Trial 9 finished with value: 0.5546319439411163 and parameters: {'n_layers': 1, 'n_units_l0': 8, 'dropout_0': 0.3208866293155346, 'learning_rate': 0.012654190241874736, 'optimizer': 'Adam'}. Best is trial 9 with value: 0.5546319439411163.
Selected Catagories are:
['DMSO_0.100_DMSO_0.025' 'LPS_0.100_DMSO_0.025']
The dimensions of the data are: (53153, 1276)
Number of total missing values across all columns: 106306
Data Subset Is Off
Wells held out for testing: ['C20' 'I14']
Wells to use for training, validation, and testing ['B14' 'C14' 'B15' 'C15' 'C16' 'C17' 'C21' 'J14' 'I15' 'J15']
Number of in features:  1251
Number of out features:  2
Binary_Classification
cpu
Validation Accuracy: 72.33409298085688
Validation Loss: 0.5568068187236787
Training Accuracy: 73.51521540916343
Training Loss: 0.5145394901600149
completed
