[NbConvertApp] WARNING | Config option `kernel_spec_manager_class` not recognized by `NbConvertApp`.
[NbConvertApp] Converting notebook ../notebooks/Hyperparameter_Optimization_model_binary.ipynb to script
[NbConvertApp] Writing 8579 bytes to Hyperparameter_Optimization_model_binary.py
cell_type: SHSY5Y control_name: DMSO_0.100_DMSO_0.025 treatment_name: LPS_Nigericin_1.000_10.0_DMSO_0.025
[I 2023-09-19 00:58:47,413] A new study created in memory with name: no-name-a0c8aa73-8da2-456d-b2ce-273e40b6217c
[I 2023-09-19 00:59:03,123] Trial 0 finished with value: 0.08316657061874866 and parameters: {'n_layers': 2, 'n_units_l0': 10, 'dropout_0': 0.28027596830033863, 'n_units_l1': 10, 'dropout_1': 0.2297195634267305, 'learning_rate': 0.08677277745473033, 'optimizer': 'SGD'}. Best is trial 0 with value: 0.08316657061874866.
[I 2023-09-19 00:59:18,083] Trial 1 finished with value: 0.13187859739363192 and parameters: {'n_layers': 1, 'n_units_l0': 5, 'dropout_0': 0.25321387592407674, 'learning_rate': 0.029524768400938026, 'optimizer': 'SGD'}. Best is trial 0 with value: 0.08316657061874866.
[I 2023-09-19 00:59:33,129] Trial 2 finished with value: 0.11428900593519212 and parameters: {'n_layers': 1, 'n_units_l0': 9, 'dropout_0': 0.17484393350494992, 'learning_rate': 0.03391236739715109, 'optimizer': 'SGD'}. Best is trial 0 with value: 0.08316657061874866.
[I 2023-09-19 00:59:48,886] Trial 3 finished with value: 0.144680465310812 and parameters: {'n_layers': 2, 'n_units_l0': 10, 'dropout_0': 0.2586103589034113, 'n_units_l1': 4, 'dropout_1': 0.18299449781552343, 'learning_rate': 0.03566210730039775, 'optimizer': 'RMSprop'}. Best is trial 0 with value: 0.08316657061874866.
[I 2023-09-19 01:00:04,618] Trial 4 finished with value: 0.18718153035640717 and parameters: {'n_layers': 3, 'n_units_l0': 6, 'dropout_0': 0.18475728388845103, 'n_units_l1': 8, 'dropout_1': 0.3552753710907912, 'n_units_l2': 2, 'dropout_2': 0.2678603005769483, 'learning_rate': 0.0459034954167343, 'optimizer': 'SGD'}. Best is trial 0 with value: 0.08316657061874866.
[I 2023-09-19 01:00:20,851] Trial 5 finished with value: 0.09369394738972188 and parameters: {'n_layers': 2, 'n_units_l0': 4, 'dropout_0': 0.14117636924829616, 'n_units_l1': 9, 'dropout_1': 0.1813707183606993, 'learning_rate': 0.01971463678257053, 'optimizer': 'Adam'}. Best is trial 0 with value: 0.08316657061874866.
[I 2023-09-19 01:00:23,374] Trial 6 pruned.
[I 2023-09-19 01:00:39,303] Trial 7 finished with value: 0.08160346354544162 and parameters: {'n_layers': 2, 'n_units_l0': 9, 'dropout_0': 0.1948307670788797, 'n_units_l1': 5, 'dropout_1': 0.15649412477025273, 'learning_rate': 0.04919634394676007, 'optimizer': 'Adam'}. Best is trial 7 with value: 0.08160346354544162.
[I 2023-09-19 01:00:39,668] Trial 8 pruned.
[I 2023-09-19 01:00:41,436] Trial 9 pruned.
Selected Catagories are:
['DMSO_0.100_DMSO_0.025' 'LPS_Nigericin_1.000_10.0_DMSO_0.025']
The dimensions of the data are: (50045, 1276)
Number of total missing values across all columns: 71286
Data Subset Is Off
Wells held out for testing: ['I14' 'M21']
Wells to use for training, validation, and testing ['B14' 'C14' 'B15' 'C15' 'J14' 'I15' 'J15' 'M16' 'M17' 'M20']
Number of in features:  1251
Number of out features:  2
Binary_Classification
cpu
Validation Accuracy: 97.30697340043135
Validation Loss: 0.12428999787569045
Training Accuracy: 97.65300497333573
Training Loss: 0.07172432794509566
completed
