[NbConvertApp] WARNING | Config option `kernel_spec_manager_class` not recognized by `NbConvertApp`.
[NbConvertApp] Converting notebook ../notebooks/Hyperparameter_Optimization_model_binary.ipynb to script
[NbConvertApp] Writing 8579 bytes to Hyperparameter_Optimization_model_binary.py
cell_type: SHSY5Y control_name: LPS_0.100_DMSO_0.025 treatment_name: Thapsigargin_10.000_DMSO_0.025
[I 2023-09-17 20:30:52,352] A new study created in memory with name: no-name-0e8c6ff5-9baf-47a1-9a6a-07db0aac4df3
[I 2023-09-17 20:31:01,909] Trial 0 finished with value: 0.3171034665902456 and parameters: {'n_layers': 3, 'n_units_l0': 7, 'dropout_0': 0.37667850886968046, 'n_units_l1': 5, 'dropout_1': 0.3573522354036377, 'n_units_l2': 5, 'dropout_2': 0.37427728144715255, 'learning_rate': 0.0055694066169172975, 'optimizer': 'RMSprop'}. Best is trial 0 with value: 0.3171034665902456.
[I 2023-09-17 20:31:10,596] Trial 1 finished with value: 0.47485297997792564 and parameters: {'n_layers': 1, 'n_units_l0': 8, 'dropout_0': 0.2715923695052954, 'learning_rate': 0.07221971828796805, 'optimizer': 'RMSprop'}. Best is trial 0 with value: 0.3171034665902456.
[I 2023-09-17 20:31:19,797] Trial 2 finished with value: 0.3367961670955022 and parameters: {'n_layers': 2, 'n_units_l0': 3, 'dropout_0': 0.3252975206339487, 'n_units_l1': 3, 'dropout_1': 0.3855306232320056, 'learning_rate': 0.04888349242226007, 'optimizer': 'Adam'}. Best is trial 0 with value: 0.3171034665902456.
[I 2023-09-17 20:31:29,016] Trial 3 finished with value: 0.3710189009706179 and parameters: {'n_layers': 3, 'n_units_l0': 6, 'dropout_0': 0.2717527899565277, 'n_units_l1': 9, 'dropout_1': 0.21816021230191765, 'n_units_l2': 5, 'dropout_2': 0.11384621876207188, 'learning_rate': 0.043996304916617913, 'optimizer': 'SGD'}. Best is trial 0 with value: 0.3171034665902456.
[I 2023-09-17 20:31:37,703] Trial 4 finished with value: 0.38093191911776864 and parameters: {'n_layers': 2, 'n_units_l0': 5, 'dropout_0': 0.3519366860967639, 'n_units_l1': 5, 'dropout_1': 0.27122972740000817, 'learning_rate': 0.030663265997430744, 'optimizer': 'SGD'}. Best is trial 0 with value: 0.3171034665902456.
[I 2023-09-17 20:31:46,605] Trial 5 finished with value: 0.21592252602179848 and parameters: {'n_layers': 1, 'n_units_l0': 10, 'dropout_0': 0.38115650150994995, 'learning_rate': 0.004441805920830996, 'optimizer': 'Adam'}. Best is trial 5 with value: 0.21592252602179848.
[I 2023-09-17 20:31:46,858] Trial 6 pruned.
[I 2023-09-17 20:31:47,025] Trial 7 pruned.
[I 2023-09-17 20:31:47,190] Trial 8 pruned.
[I 2023-09-17 20:31:47,353] Trial 9 pruned.
Selected Catagories are:
['Thapsigargin_10.000_DMSO_0.025' 'LPS_0.100_DMSO_0.025']
The dimensions of the data are: (30722, 1276)
Number of total missing values across all columns: 61444
Data Subset Is Off
Wells held out for testing: ['E14' 'C20']
Wells to use for training, validation, and testing ['E15' 'C16' 'C17' 'C21' 'L14' 'L15']
Number of in features:  1251
Number of out features:  2
Binary_Classification
cpu
Validation Accuracy: 93.94143356643355
Validation Loss: 0.19582215587298074
Training Accuracy: 94.72600120198875
Training Loss: 0.14691437471854057
completed
