[NbConvertApp] WARNING | Config option `kernel_spec_manager_class` not recognized by `NbConvertApp`.
[NbConvertApp] Converting notebook ../notebooks/Hyperparameter_Optimization_model_binary.ipynb to script
[NbConvertApp] Writing 8579 bytes to Hyperparameter_Optimization_model_binary.py
cell_type: PBMC control_name: LPS_0.010_DMSO_0.025 treatment_name: Thapsigargin_10.000_DMSO_0.025
[I 2023-09-19 01:28:26,774] A new study created in memory with name: no-name-9de0a06e-5d72-487a-8899-1111951aead8
[I 2023-09-19 01:29:48,157] Trial 0 finished with value: 0.27630574919607326 and parameters: {'n_layers': 1, 'n_units_l0': 10, 'dropout_0': 0.3158256347864137, 'learning_rate': 0.07996868946902372, 'optimizer': 'SGD'}. Best is trial 0 with value: 0.27630574919607326.
[I 2023-09-19 01:31:06,870] Trial 1 finished with value: 0.32304343609706215 and parameters: {'n_layers': 1, 'n_units_l0': 5, 'dropout_0': 0.29789609367533804, 'learning_rate': 0.06828187991139394, 'optimizer': 'SGD'}. Best is trial 0 with value: 0.27630574919607326.
[I 2023-09-19 01:32:27,531] Trial 2 finished with value: 0.3568586023475813 and parameters: {'n_layers': 2, 'n_units_l0': 4, 'dropout_0': 0.3312034981043751, 'n_units_l1': 10, 'dropout_1': 0.34053887598623334, 'learning_rate': 0.060499329270781034, 'optimizer': 'SGD'}. Best is trial 0 with value: 0.27630574919607326.
[I 2023-09-19 01:33:52,262] Trial 3 finished with value: 0.6834579364631486 and parameters: {'n_layers': 3, 'n_units_l0': 6, 'dropout_0': 0.3118597573148561, 'n_units_l1': 9, 'dropout_1': 0.24615806932562045, 'n_units_l2': 5, 'dropout_2': 0.16732960163325605, 'learning_rate': 0.06854823980976286, 'optimizer': 'RMSprop'}. Best is trial 0 with value: 0.27630574919607326.
[I 2023-09-19 01:35:14,138] Trial 4 finished with value: 0.30914867881847463 and parameters: {'n_layers': 2, 'n_units_l0': 9, 'dropout_0': 0.3394936966702628, 'n_units_l1': 8, 'dropout_1': 0.2692871167704906, 'learning_rate': 0.06747424370834973, 'optimizer': 'SGD'}. Best is trial 0 with value: 0.27630574919607326.
[I 2023-09-19 01:35:15,797] Trial 5 pruned.
[I 2023-09-19 01:35:27,619] Trial 6 pruned.
[I 2023-09-19 01:36:19,575] Trial 7 pruned.
[I 2023-09-19 01:36:21,294] Trial 8 pruned.
[I 2023-09-19 01:37:44,305] Trial 9 finished with value: 0.27970314387394035 and parameters: {'n_layers': 1, 'n_units_l0': 10, 'dropout_0': 0.29701219211406527, 'learning_rate': 0.04358419994274611, 'optimizer': 'Adam'}. Best is trial 0 with value: 0.27630574919607326.
Selected Catagories are:
['LPS_0.010_DMSO_0.025' 'Thapsigargin_10.000_DMSO_0.025']
The dimensions of the data are: (310064, 1270)
Number of total missing values across all columns: 620128
Data Subset Is Off
Wells held out for testing: ['B08' 'L06']
Wells to use for training, validation, and testing ['B02' 'B03' 'B09' 'E06' 'E07' 'L07']
Number of in features:  1245
Number of out features:  2
Binary_Classification
cpu
Validation Accuracy: 88.29059379926431
Validation Loss: 0.278536697677944
Training Accuracy: 85.62560761988178
Training Loss: 0.31698539233435696
completed
