[NbConvertApp] WARNING | Config option `kernel_spec_manager_class` not recognized by `NbConvertApp`.
[NbConvertApp] Converting notebook ../notebooks/Hyperparameter_Optimization_model_binary.ipynb to script
[NbConvertApp] Writing 8579 bytes to Hyperparameter_Optimization_model_binary.py
cell_type: SHSY5Y control_name: LPS_Nigericin_1.000_1.0_DMSO_0.025 treatment_name: LPS_0.100_DMSO_0.025
[I 2023-09-17 20:22:08,808] A new study created in memory with name: no-name-028c1ce3-4fb5-4f1c-bbd2-c30051241870
[I 2023-09-17 20:22:21,195] Trial 0 finished with value: 0.4955021101236343 and parameters: {'n_layers': 2, 'n_units_l0': 6, 'dropout_0': 0.11119674034533295, 'n_units_l1': 7, 'dropout_1': 0.14976361619539222, 'learning_rate': 0.007738758947931899, 'optimizer': 'SGD'}. Best is trial 0 with value: 0.4955021101236343.
[I 2023-09-17 20:22:33,121] Trial 1 finished with value: 0.18011831402778625 and parameters: {'n_layers': 1, 'n_units_l0': 9, 'dropout_0': 0.3561242697418725, 'learning_rate': 0.009584459180447877, 'optimizer': 'Adam'}. Best is trial 1 with value: 0.18011831402778625.
[I 2023-09-17 20:22:44,863] Trial 2 finished with value: 0.27852329750855764 and parameters: {'n_layers': 2, 'n_units_l0': 10, 'dropout_0': 0.3169118716914794, 'n_units_l1': 5, 'dropout_1': 0.34273302741722056, 'learning_rate': 0.060349180776214005, 'optimizer': 'Adam'}. Best is trial 1 with value: 0.18011831402778625.
[I 2023-09-17 20:22:56,306] Trial 3 finished with value: 0.4597874023516973 and parameters: {'n_layers': 2, 'n_units_l0': 9, 'dropout_0': 0.27463431599983, 'n_units_l1': 5, 'dropout_1': 0.11967538444390749, 'learning_rate': 0.062202154898345914, 'optimizer': 'RMSprop'}. Best is trial 1 with value: 0.18011831402778625.
[I 2023-09-17 20:23:08,050] Trial 4 finished with value: 0.22234416003028554 and parameters: {'n_layers': 2, 'n_units_l0': 10, 'dropout_0': 0.3063647802250993, 'n_units_l1': 6, 'dropout_1': 0.35396480743283476, 'learning_rate': 0.027422395002508752, 'optimizer': 'Adam'}. Best is trial 1 with value: 0.18011831402778625.
[I 2023-09-17 20:23:08,327] Trial 5 pruned.
[I 2023-09-17 20:23:20,145] Trial 6 finished with value: 0.18139176463087398 and parameters: {'n_layers': 1, 'n_units_l0': 2, 'dropout_0': 0.3516185713350237, 'learning_rate': 0.033617118871985575, 'optimizer': 'Adam'}. Best is trial 1 with value: 0.18011831402778625.
[I 2023-09-17 20:23:20,449] Trial 7 pruned.
[I 2023-09-17 20:23:20,650] Trial 8 pruned.
[I 2023-09-17 20:23:20,847] Trial 9 pruned.
Selected Catagories are:
['LPS_0.100_DMSO_0.025' 'LPS_Nigericin_1.000_1.0_DMSO_0.025']
The dimensions of the data are: (33728, 1276)
Number of total missing values across all columns: 35020
Data Subset Is Off
Wells held out for testing: ['C20' 'K16']
Wells to use for training, validation, and testing ['C16' 'C17' 'C21' 'K17' 'K20' 'K21']
Number of in features:  1251
Number of out features:  2
Binary_Classification
cpu
Validation Accuracy: 95.11483253588518
Validation Loss: 0.21862978239854175
Training Accuracy: 94.30863581970483
Training Loss: 0.11484164900545561
completed
