[NbConvertApp] WARNING | Config option `kernel_spec_manager_class` not recognized by `NbConvertApp`.
[NbConvertApp] Converting notebook ../notebooks/Hyperparameter_Optimization_model_binary.ipynb to script
[NbConvertApp] Writing 8579 bytes to Hyperparameter_Optimization_model_binary.py
cell_type: PBMC control_name: LPS_10.000_DMSO_0.025 treatment_name: Flagellin_0.100_DMSO_0.025
[I 2023-09-17 19:35:20,674] A new study created in memory with name: no-name-043e9dbf-ac3c-4e58-8771-637a3bc37a0e
[I 2023-09-17 19:36:41,852] Trial 0 finished with value: 0.6427888674868478 and parameters: {'n_layers': 3, 'n_units_l0': 7, 'dropout_0': 0.10799690183819566, 'n_units_l1': 10, 'dropout_1': 0.2620485378660322, 'n_units_l2': 9, 'dropout_2': 0.3661861861688477, 'learning_rate': 0.07616694771548657, 'optimizer': 'RMSprop'}. Best is trial 0 with value: 0.6427888674868478.
[I 2023-09-17 19:38:00,421] Trial 1 finished with value: 0.4884687484635247 and parameters: {'n_layers': 2, 'n_units_l0': 6, 'dropout_0': 0.16491169264588382, 'n_units_l1': 10, 'dropout_1': 0.18390533642899043, 'learning_rate': 0.04615067383915252, 'optimizer': 'RMSprop'}. Best is trial 1 with value: 0.4884687484635247.
[I 2023-09-17 19:39:16,836] Trial 2 finished with value: 0.43135930365986297 and parameters: {'n_layers': 1, 'n_units_l0': 5, 'dropout_0': 0.1845980251774742, 'learning_rate': 0.08061938215278194, 'optimizer': 'Adam'}. Best is trial 2 with value: 0.43135930365986297.
[I 2023-09-17 19:40:36,652] Trial 3 finished with value: 0.651200616425938 and parameters: {'n_layers': 3, 'n_units_l0': 6, 'dropout_0': 0.3984874596599629, 'n_units_l1': 3, 'dropout_1': 0.18618872940319378, 'n_units_l2': 9, 'dropout_2': 0.1709095958525701, 'learning_rate': 0.09074485648112719, 'optimizer': 'RMSprop'}. Best is trial 2 with value: 0.43135930365986297.
[I 2023-09-17 19:41:52,735] Trial 4 finished with value: 0.5176760578817792 and parameters: {'n_layers': 1, 'n_units_l0': 8, 'dropout_0': 0.17766470249366395, 'learning_rate': 0.008651097800590648, 'optimizer': 'SGD'}. Best is trial 2 with value: 0.43135930365986297.
[I 2023-09-17 19:43:12,688] Trial 5 finished with value: 0.43977112763457826 and parameters: {'n_layers': 3, 'n_units_l0': 7, 'dropout_0': 0.3227365486298847, 'n_units_l1': 10, 'dropout_1': 0.1334347265888925, 'n_units_l2': 3, 'dropout_2': 0.12071903800392172, 'learning_rate': 0.09439541532246706, 'optimizer': 'SGD'}. Best is trial 2 with value: 0.43135930365986297.
[I 2023-09-17 19:43:14,321] Trial 6 pruned.
[I 2023-09-17 19:44:30,959] Trial 7 finished with value: 0.500079238679674 and parameters: {'n_layers': 2, 'n_units_l0': 2, 'dropout_0': 0.179194623493723, 'n_units_l1': 5, 'dropout_1': 0.38124129425289544, 'learning_rate': 0.0941578159030307, 'optimizer': 'SGD'}. Best is trial 2 with value: 0.43135930365986297.
[I 2023-09-17 19:44:32,492] Trial 8 pruned.
[I 2023-09-17 19:45:49,162] Trial 9 finished with value: 0.4796335727307531 and parameters: {'n_layers': 2, 'n_units_l0': 5, 'dropout_0': 0.2742217432836156, 'n_units_l1': 4, 'dropout_1': 0.12768222885342728, 'learning_rate': 0.057456405603553584, 'optimizer': 'SGD'}. Best is trial 2 with value: 0.43135930365986297.
Selected Catagories are:
['LPS_10.000_DMSO_0.025' 'Flagellin_0.100_DMSO_0.025']
The dimensions of the data are: (252405, 1270)
Number of total missing values across all columns: 504810
Data Subset Is Off
Wells held out for testing: ['E09' 'L10']
Wells to use for training, validation, and testing ['E02' 'E03' 'E08' 'L05' 'L11']
Number of in features:  1245
Number of out features:  2
Binary_Classification
cpu
Validation Accuracy: 80.5883870967742
Validation Loss: 0.4344755598902703
Training Accuracy: 79.13793611276692
Training Loss: 0.4493018388289672
completed
