[NbConvertApp] WARNING | Config option `kernel_spec_manager_class` not recognized by `NbConvertApp`.
[NbConvertApp] Converting notebook ../notebooks/Hyperparameter_Optimization_model_binary.ipynb to script
[NbConvertApp] Writing 8579 bytes to Hyperparameter_Optimization_model_binary.py
cell_type: SHSY5Y control_name: LPS_1.000_DMSO_0.025 treatment_name: Flagellin_1.000_DMSO_0.025
[I 2023-09-19 00:40:26,549] A new study created in memory with name: no-name-18c15ac3-38d2-45cc-a419-0da8366f2664
[I 2023-09-19 00:40:36,433] Trial 0 finished with value: 0.6421500500043235 and parameters: {'n_layers': 1, 'n_units_l0': 4, 'dropout_0': 0.14901392074967823, 'learning_rate': 0.03543178809562929, 'optimizer': 'RMSprop'}. Best is trial 0 with value: 0.6421500500043235.
[I 2023-09-19 00:40:46,212] Trial 1 finished with value: 1.2927878522872924 and parameters: {'n_layers': 1, 'n_units_l0': 7, 'dropout_0': 0.10321743547942192, 'learning_rate': 0.09931813192903022, 'optimizer': 'RMSprop'}. Best is trial 0 with value: 0.6421500500043235.
[I 2023-09-19 00:40:56,065] Trial 2 finished with value: 0.5753597680727641 and parameters: {'n_layers': 1, 'n_units_l0': 7, 'dropout_0': 0.17724222399221234, 'learning_rate': 0.012874999743285927, 'optimizer': 'Adam'}. Best is trial 2 with value: 0.5753597680727641.
[I 2023-09-19 00:41:06,121] Trial 3 finished with value: 0.6883178079128265 and parameters: {'n_layers': 3, 'n_units_l0': 3, 'dropout_0': 0.31052123047646574, 'n_units_l1': 10, 'dropout_1': 0.17873978733888765, 'n_units_l2': 8, 'dropout_2': 0.3782221497247007, 'learning_rate': 0.058669743807460706, 'optimizer': 'RMSprop'}. Best is trial 2 with value: 0.5753597680727641.
[I 2023-09-19 00:41:16,046] Trial 4 finished with value: 0.5696362125873565 and parameters: {'n_layers': 2, 'n_units_l0': 7, 'dropout_0': 0.2959810833294146, 'n_units_l1': 4, 'dropout_1': 0.12320907905573267, 'learning_rate': 0.025474455749975835, 'optimizer': 'Adam'}. Best is trial 4 with value: 0.5696362125873565.
[I 2023-09-19 00:41:26,186] Trial 5 finished with value: 0.5649160488446554 and parameters: {'n_layers': 3, 'n_units_l0': 8, 'dropout_0': 0.2993351738857388, 'n_units_l1': 8, 'dropout_1': 0.38469566413860945, 'n_units_l2': 3, 'dropout_2': 0.3131702666678636, 'learning_rate': 0.008011729937265457, 'optimizer': 'Adam'}. Best is trial 5 with value: 0.5649160488446554.
[I 2023-09-19 00:41:35,799] Trial 6 finished with value: 0.5743020578225453 and parameters: {'n_layers': 1, 'n_units_l0': 9, 'dropout_0': 0.2905539999447063, 'learning_rate': 0.0027683982211125437, 'optimizer': 'RMSprop'}. Best is trial 5 with value: 0.5649160488446554.
[I 2023-09-19 00:41:35,973] Trial 7 pruned.
[I 2023-09-19 00:41:36,149] Trial 8 pruned.
[I 2023-09-19 00:41:36,331] Trial 9 pruned.
Selected Catagories are:
['LPS_1.000_DMSO_0.025' 'Flagellin_1.000_DMSO_0.025']
The dimensions of the data are: (32267, 1276)
Number of total missing values across all columns: 64534
Data Subset Is Off
Wells held out for testing: ['D21' 'M22']
Wells to use for training, validation, and testing ['D16' 'D17' 'D20' 'M18' 'M19' 'M23']
Number of in features:  1251
Number of out features:  2
Binary_Classification
cpu
Validation Accuracy: 71.14508836826963
Validation Loss: 0.5600181929270426
Training Accuracy: 71.7667129130055
Training Loss: 0.5479570284485817
completed
