[NbConvertApp] WARNING | Config option `kernel_spec_manager_class` not recognized by `NbConvertApp`.
[NbConvertApp] Converting notebook ../notebooks/Hyperparameter_Optimization_model_binary.ipynb to script
[NbConvertApp] Writing 8579 bytes to Hyperparameter_Optimization_model_binary.py
cell_type: PBMC control_name: LPS_10.000_DMSO_0.025 treatment_name: LPS_Nigericin_1.000_10.0_DMSO_0.025
[I 2023-09-19 01:03:28,085] A new study created in memory with name: no-name-68cabbd8-98bb-4c6f-8b4c-907132f0bd2a
[I 2023-09-19 01:05:17,093] Trial 0 finished with value: 0.22343687531948092 and parameters: {'n_layers': 3, 'n_units_l0': 3, 'dropout_0': 0.317776548137059, 'n_units_l1': 4, 'dropout_1': 0.14525990837147368, 'n_units_l2': 10, 'dropout_2': 0.3542387792621724, 'learning_rate': 0.014486486510048354, 'optimizer': 'RMSprop'}. Best is trial 0 with value: 0.22343687531948092.
[I 2023-09-19 01:07:06,991] Trial 1 finished with value: 0.11436610485315322 and parameters: {'n_layers': 3, 'n_units_l0': 10, 'dropout_0': 0.2757908298213233, 'n_units_l1': 10, 'dropout_1': 0.1743337397575904, 'n_units_l2': 9, 'dropout_2': 0.2508067812464565, 'learning_rate': 0.04275311277715715, 'optimizer': 'SGD'}. Best is trial 1 with value: 0.11436610485315322.
[I 2023-09-19 01:08:51,444] Trial 2 finished with value: 0.14045130605101586 and parameters: {'n_layers': 1, 'n_units_l0': 2, 'dropout_0': 0.28508755033134414, 'learning_rate': 0.023165783002126367, 'optimizer': 'RMSprop'}. Best is trial 1 with value: 0.11436610485315322.
[I 2023-09-19 01:10:38,058] Trial 3 finished with value: 0.12692525316476821 and parameters: {'n_layers': 2, 'n_units_l0': 7, 'dropout_0': 0.25823905105477196, 'n_units_l1': 4, 'dropout_1': 0.3775088376023491, 'learning_rate': 0.043106597852472, 'optimizer': 'SGD'}. Best is trial 1 with value: 0.11436610485315322.
[I 2023-09-19 01:12:23,074] Trial 4 finished with value: 0.13499434673786165 and parameters: {'n_layers': 2, 'n_units_l0': 9, 'dropout_0': 0.37184855653305215, 'n_units_l1': 7, 'dropout_1': 0.25462250024839184, 'learning_rate': 0.02384613092581892, 'optimizer': 'SGD'}. Best is trial 1 with value: 0.11436610485315322.
[I 2023-09-19 01:14:12,978] Trial 5 finished with value: 0.1094352341413498 and parameters: {'n_layers': 3, 'n_units_l0': 9, 'dropout_0': 0.20733756476022575, 'n_units_l1': 10, 'dropout_1': 0.1532215693077229, 'n_units_l2': 4, 'dropout_2': 0.13774164301183395, 'learning_rate': 0.026529039213101676, 'optimizer': 'RMSprop'}. Best is trial 5 with value: 0.1094352341413498.
[I 2023-09-19 01:16:00,172] Trial 6 finished with value: 0.10382735577523709 and parameters: {'n_layers': 2, 'n_units_l0': 10, 'dropout_0': 0.14200987522546388, 'n_units_l1': 9, 'dropout_1': 0.14942976193398672, 'learning_rate': 0.01909417508419101, 'optimizer': 'RMSprop'}. Best is trial 6 with value: 0.10382735577523709.
[I 2023-09-19 01:16:08,941] Trial 7 pruned.
[I 2023-09-19 01:17:41,147] Trial 8 pruned.
[I 2023-09-19 01:17:43,241] Trial 9 pruned.
Selected Catagories are:
['LPS_10.000_DMSO_0.025' 'LPS_Nigericin_1.000_10.0_DMSO_0.025']
The dimensions of the data are: (337656, 1270)
Number of total missing values across all columns: 312980
Data Subset Is Off
Wells held out for testing: ['E09' 'M09']
Wells to use for training, validation, and testing ['E02' 'E03' 'E08' 'M02' 'M03' 'M08']
Number of in features:  1245
Number of out features:  2
Binary_Classification
cpu
Validation Accuracy: 96.6676662479232
Validation Loss: 0.10805130730569364
Training Accuracy: 96.3280804396829
Training Loss: 0.10575499379838055
completed
