[NbConvertApp] WARNING | Config option `kernel_spec_manager_class` not recognized by `NbConvertApp`.
[NbConvertApp] Converting notebook ../notebooks/Hyperparameter_Optimization_model_binary.ipynb to script
[NbConvertApp] Writing 8579 bytes to Hyperparameter_Optimization_model_binary.py
cell_type: SHSY5Y control_name: LPS_10.000_DMSO_0.025 treatment_name: H2O2_100.000_DMSO_0.025
[I 2023-09-19 01:34:50,669] A new study created in memory with name: no-name-776047e9-18b2-4d7d-8128-33f37f8c835a
[I 2023-09-19 01:35:04,849] Trial 0 finished with value: 0.4649757048487663 and parameters: {'n_layers': 1, 'n_units_l0': 8, 'dropout_0': 0.1521683484697125, 'learning_rate': 0.028530726139164245, 'optimizer': 'Adam'}. Best is trial 0 with value: 0.4649757048487663.
[I 2023-09-19 01:35:18,867] Trial 1 finished with value: 0.45383933767676354 and parameters: {'n_layers': 1, 'n_units_l0': 8, 'dropout_0': 0.3711242689600769, 'learning_rate': 0.05533088082047517, 'optimizer': 'Adam'}. Best is trial 1 with value: 0.45383933767676354.
[I 2023-09-19 01:35:32,612] Trial 2 finished with value: 0.4906982706487179 and parameters: {'n_layers': 1, 'n_units_l0': 6, 'dropout_0': 0.3463133354382609, 'learning_rate': 0.04343915816339118, 'optimizer': 'RMSprop'}. Best is trial 1 with value: 0.45383933767676354.
[I 2023-09-19 01:35:46,043] Trial 3 finished with value: 0.45742458909749983 and parameters: {'n_layers': 1, 'n_units_l0': 5, 'dropout_0': 0.320138357508022, 'learning_rate': 0.06533335925003576, 'optimizer': 'SGD'}. Best is trial 1 with value: 0.45383933767676354.
[I 2023-09-19 01:35:59,835] Trial 4 finished with value: 0.46977198764681816 and parameters: {'n_layers': 1, 'n_units_l0': 4, 'dropout_0': 0.3259213483470904, 'learning_rate': 0.027013657462729945, 'optimizer': 'RMSprop'}. Best is trial 1 with value: 0.45383933767676354.
[I 2023-09-19 01:36:00,109] Trial 5 pruned.
[I 2023-09-19 01:36:00,442] Trial 6 pruned.
[I 2023-09-19 01:36:00,704] Trial 7 pruned.
[I 2023-09-19 01:36:00,961] Trial 8 pruned.
[I 2023-09-19 01:36:01,303] Trial 9 pruned.
Selected Catagories are:
['LPS_10.000_DMSO_0.025' 'H2O2_100.000_DMSO_0.025']
The dimensions of the data are: (43710, 1276)
Number of total missing values across all columns: 87420
Data Subset Is Off
Wells held out for testing: ['E21' 'H22']
Wells to use for training, validation, and testing ['E16' 'E17' 'H18' 'H19' 'E20' 'H23' 'I18' 'I19' 'I22' 'I23']
Number of in features:  1251
Number of out features:  2
Binary_Classification
cpu
Validation Accuracy: 77.40667420814479
Validation Loss: 0.4561171855032444
Training Accuracy: 78.54901544879273
Training Loss: 0.42212316749424766
completed
