[NbConvertApp] WARNING | Config option `kernel_spec_manager_class` not recognized by `NbConvertApp`.
[NbConvertApp] Converting notebook ../notebooks/Hyperparameter_Optimization_model_binary.ipynb to script
[NbConvertApp] Writing 8579 bytes to Hyperparameter_Optimization_model_binary.py
cell_type: PBMC control_name: Thapsigargin_1.000_DMSO_0.025 treatment_name: LPS_1.000_DMSO_0.025
[I 2023-09-19 01:17:30,946] A new study created in memory with name: no-name-36e411da-9e2b-48e6-a48c-bc0dba376a75
[I 2023-09-19 01:18:42,211] Trial 0 finished with value: 0.3937340192000071 and parameters: {'n_layers': 2, 'n_units_l0': 9, 'dropout_0': 0.14878500911153156, 'n_units_l1': 4, 'dropout_1': 0.23584751343188035, 'learning_rate': 0.04153767752400247, 'optimizer': 'SGD'}. Best is trial 0 with value: 0.3937340192000071.
[I 2023-09-19 01:19:52,623] Trial 1 finished with value: 0.41809330710342957 and parameters: {'n_layers': 1, 'n_units_l0': 4, 'dropout_0': 0.35417587367572156, 'learning_rate': 0.014419070250743921, 'optimizer': 'Adam'}. Best is trial 0 with value: 0.3937340192000071.
[I 2023-09-19 01:21:08,478] Trial 2 finished with value: 0.6921089449950628 and parameters: {'n_layers': 3, 'n_units_l0': 10, 'dropout_0': 0.33164105688265155, 'n_units_l1': 10, 'dropout_1': 0.34642153230686656, 'n_units_l2': 3, 'dropout_2': 0.23053082285813986, 'learning_rate': 0.06446842451356016, 'optimizer': 'RMSprop'}. Best is trial 0 with value: 0.3937340192000071.
[I 2023-09-19 01:22:19,896] Trial 3 finished with value: 0.5050221654630842 and parameters: {'n_layers': 1, 'n_units_l0': 7, 'dropout_0': 0.11354305743484158, 'learning_rate': 0.06688210443728847, 'optimizer': 'RMSprop'}. Best is trial 0 with value: 0.3937340192000071.
[I 2023-09-19 01:23:33,108] Trial 4 finished with value: 0.43898250894887103 and parameters: {'n_layers': 3, 'n_units_l0': 8, 'dropout_0': 0.13970710869102912, 'n_units_l1': 3, 'dropout_1': 0.3740788850133422, 'n_units_l2': 9, 'dropout_2': 0.3889214728754995, 'learning_rate': 0.05282898594297342, 'optimizer': 'SGD'}. Best is trial 0 with value: 0.3937340192000071.
[I 2023-09-19 01:24:45,953] Trial 5 finished with value: 0.39971427298727485 and parameters: {'n_layers': 2, 'n_units_l0': 3, 'dropout_0': 0.11406123829285411, 'n_units_l1': 5, 'dropout_1': 0.1856034471736085, 'learning_rate': 0.033810867346108005, 'optimizer': 'Adam'}. Best is trial 0 with value: 0.3937340192000071.
[I 2023-09-19 01:24:51,919] Trial 6 pruned.
[I 2023-09-19 01:24:53,476] Trial 7 pruned.
[I 2023-09-19 01:25:10,303] Trial 8 pruned.
[I 2023-09-19 01:25:17,225] Trial 9 pruned.
Selected Catagories are:
['LPS_1.000_DMSO_0.025' 'Thapsigargin_1.000_DMSO_0.025']
The dimensions of the data are: (287889, 1270)
Number of total missing values across all columns: 575778
Data Subset Is Off
Wells held out for testing: ['D08' 'K06']
Wells to use for training, validation, and testing ['D02' 'D03' 'D06' 'D07' 'D09' 'K07']
Number of in features:  1245
Number of out features:  2
Binary_Classification
cpu
Validation Accuracy: 82.8473817124887
Validation Loss: 0.3829620579878489
Training Accuracy: 79.19958784009148
Training Loss: 0.42876381125478524
completed
