[NbConvertApp] WARNING | Config option `kernel_spec_manager_class` not recognized by `NbConvertApp`.
[NbConvertApp] Converting notebook ../notebooks/Hyperparameter_Optimization_model_binary.ipynb to script
[NbConvertApp] Writing 8579 bytes to Hyperparameter_Optimization_model_binary.py
cell_type: SHSY5Y control_name: Flagellin_1.000_DMSO_0.025 treatment_name: LPS_0.100_DMSO_0.025
[I 2023-09-17 20:21:40,313] A new study created in memory with name: no-name-469e6c17-c599-4453-a8bb-2f2ca09fd143
[I 2023-09-17 20:21:50,842] Trial 0 finished with value: 0.6918256465593974 and parameters: {'n_layers': 3, 'n_units_l0': 8, 'dropout_0': 0.27037315655330674, 'n_units_l1': 8, 'dropout_1': 0.327584836947754, 'n_units_l2': 3, 'dropout_2': 0.2961131460728027, 'learning_rate': 0.040189424461113475, 'optimizer': 'RMSprop'}. Best is trial 0 with value: 0.6918256465593974.
[I 2023-09-17 20:22:00,885] Trial 1 finished with value: 0.5866400976975759 and parameters: {'n_layers': 1, 'n_units_l0': 2, 'dropout_0': 0.2600948824388617, 'learning_rate': 0.06833990461810488, 'optimizer': 'SGD'}. Best is trial 1 with value: 0.5866400976975759.
[I 2023-09-17 20:22:11,186] Trial 2 finished with value: 0.6516497592131296 and parameters: {'n_layers': 3, 'n_units_l0': 9, 'dropout_0': 0.3161650427201187, 'n_units_l1': 7, 'dropout_1': 0.1985311803408511, 'n_units_l2': 5, 'dropout_2': 0.3619434828496969, 'learning_rate': 0.05660320446725312, 'optimizer': 'SGD'}. Best is trial 1 with value: 0.5866400976975759.
[I 2023-09-17 20:22:21,263] Trial 3 finished with value: 1.3287905144691468 and parameters: {'n_layers': 1, 'n_units_l0': 7, 'dropout_0': 0.1518806083413651, 'learning_rate': 0.07994142319706665, 'optimizer': 'RMSprop'}. Best is trial 1 with value: 0.5866400976975759.
[I 2023-09-17 20:22:31,591] Trial 4 finished with value: 0.6917917784055075 and parameters: {'n_layers': 3, 'n_units_l0': 6, 'dropout_0': 0.3863016583526683, 'n_units_l1': 5, 'dropout_1': 0.3600978118512381, 'n_units_l2': 6, 'dropout_2': 0.3654934990166, 'learning_rate': 0.07450612484317201, 'optimizer': 'RMSprop'}. Best is trial 1 with value: 0.5866400976975759.
[I 2023-09-17 20:22:42,189] Trial 5 finished with value: 0.565673048098882 and parameters: {'n_layers': 3, 'n_units_l0': 3, 'dropout_0': 0.3095272585990525, 'n_units_l1': 8, 'dropout_1': 0.3132405070282743, 'n_units_l2': 10, 'dropout_2': 0.11094539838405038, 'learning_rate': 0.012458620093979184, 'optimizer': 'RMSprop'}. Best is trial 5 with value: 0.565673048098882.
[I 2023-09-17 20:22:42,377] Trial 6 pruned.
[I 2023-09-17 20:22:52,888] Trial 7 finished with value: 0.5439399427175521 and parameters: {'n_layers': 3, 'n_units_l0': 4, 'dropout_0': 0.34981562774317526, 'n_units_l1': 7, 'dropout_1': 0.12127147763120003, 'n_units_l2': 4, 'dropout_2': 0.18765932068165675, 'learning_rate': 0.02898755661912346, 'optimizer': 'Adam'}. Best is trial 7 with value: 0.5439399427175521.
[I 2023-09-17 20:23:02,773] Trial 8 finished with value: 0.5312305702765783 and parameters: {'n_layers': 1, 'n_units_l0': 4, 'dropout_0': 0.10159348277017119, 'learning_rate': 0.08219837287509359, 'optimizer': 'SGD'}. Best is trial 8 with value: 0.5312305702765783.
[I 2023-09-17 20:23:04,160] Trial 9 pruned.
Selected Catagories are:
['LPS_0.100_DMSO_0.025' 'Flagellin_1.000_DMSO_0.025']
The dimensions of the data are: (33319, 1276)
Number of total missing values across all columns: 66638
Data Subset Is Off
Wells held out for testing: ['C21' 'M22']
Wells to use for training, validation, and testing ['C16' 'C17' 'C20' 'M18' 'M19' 'M23']
Number of in features:  1251
Number of out features:  2
Binary_Classification
cpu
Validation Accuracy: 71.9991935483871
Validation Loss: 0.5408938725789387
Training Accuracy: 73.26990369586044
Training Loss: 0.508152666002512
completed
