[NbConvertApp] WARNING | Config option `kernel_spec_manager_class` not recognized by `NbConvertApp`.
[NbConvertApp] Converting notebook ../notebooks/Hyperparameter_Optimization_model_binary.ipynb to script
[NbConvertApp] Writing 8579 bytes to Hyperparameter_Optimization_model_binary.py
cell_type: SHSY5Y control_name: DMSO_0.100_DMSO_0.025 treatment_name: Flagellin_1.000_DMSO_0.025
[I 2023-09-19 00:32:58,890] A new study created in memory with name: no-name-7c1a853a-9818-4a83-a0c1-de35ee21b9dc
[I 2023-09-19 00:33:13,534] Trial 0 finished with value: 0.8485162547826767 and parameters: {'n_layers': 1, 'n_units_l0': 7, 'dropout_0': 0.2305427386613374, 'learning_rate': 0.06307258821702424, 'optimizer': 'RMSprop'}. Best is trial 0 with value: 0.8485162547826767.
[I 2023-09-19 00:33:28,441] Trial 1 finished with value: 0.4720126065015793 and parameters: {'n_layers': 3, 'n_units_l0': 9, 'dropout_0': 0.3737998172409226, 'n_units_l1': 8, 'dropout_1': 0.12490700583688155, 'n_units_l2': 5, 'dropout_2': 0.19922162552585354, 'learning_rate': 0.006076425258952668, 'optimizer': 'RMSprop'}. Best is trial 1 with value: 0.4720126065015793.
[I 2023-09-19 00:33:43,487] Trial 2 finished with value: 0.5714708052873612 and parameters: {'n_layers': 3, 'n_units_l0': 3, 'dropout_0': 0.19350389842598933, 'n_units_l1': 3, 'dropout_1': 0.10750273012074389, 'n_units_l2': 4, 'dropout_2': 0.11256284468006113, 'learning_rate': 0.07802807059047473, 'optimizer': 'RMSprop'}. Best is trial 1 with value: 0.4720126065015793.
[I 2023-09-19 00:33:57,972] Trial 3 finished with value: 0.5022042620182038 and parameters: {'n_layers': 2, 'n_units_l0': 8, 'dropout_0': 0.38132729407555066, 'n_units_l1': 4, 'dropout_1': 0.2747769091240613, 'learning_rate': 0.05674450871146668, 'optimizer': 'SGD'}. Best is trial 1 with value: 0.4720126065015793.
[I 2023-09-19 00:34:12,937] Trial 4 finished with value: 0.47679087889194494 and parameters: {'n_layers': 2, 'n_units_l0': 6, 'dropout_0': 0.27433415286193436, 'n_units_l1': 7, 'dropout_1': 0.27320139595757365, 'learning_rate': 0.027149795416144894, 'optimizer': 'Adam'}. Best is trial 1 with value: 0.4720126065015793.
[I 2023-09-19 00:34:13,207] Trial 5 pruned.
[I 2023-09-19 00:34:28,100] Trial 6 finished with value: 0.4734245183467865 and parameters: {'n_layers': 2, 'n_units_l0': 8, 'dropout_0': 0.2398098953180624, 'n_units_l1': 2, 'dropout_1': 0.20214607331495024, 'learning_rate': 0.025249731476454252, 'optimizer': 'Adam'}. Best is trial 1 with value: 0.4720126065015793.
[I 2023-09-19 00:34:28,448] Trial 7 pruned.
[I 2023-09-19 00:34:28,715] Trial 8 pruned.
[I 2023-09-19 00:34:28,980] Trial 9 pruned.
Selected Catagories are:
['DMSO_0.100_DMSO_0.025' 'Flagellin_1.000_DMSO_0.025']
The dimensions of the data are: (51452, 1276)
Number of total missing values across all columns: 102904
Data Subset Is Off
Wells held out for testing: ['I14' 'M23']
Wells to use for training, validation, and testing ['B14' 'C14' 'B15' 'C15' 'J14' 'I15' 'J15' 'M18' 'M19' 'M22']
Number of in features:  1251
Number of out features:  2
Binary_Classification
cpu
Validation Accuracy: 77.554825076309
Validation Loss: 0.46325658726692204
Training Accuracy: 77.233446818502
Training Loss: 0.4483788108059338
completed
