[NbConvertApp] WARNING | Config option `kernel_spec_manager_class` not recognized by `NbConvertApp`.
[NbConvertApp] Converting notebook ../notebooks/Hyperparameter_Optimization_model_binary.ipynb to script
[NbConvertApp] Writing 8579 bytes to Hyperparameter_Optimization_model_binary.py
cell_type: PBMC control_name: Thapsigargin_10.000_DMSO_0.025 treatment_name: LPS_0.100_DMSO_0.025
[I 2023-09-17 20:26:44,229] A new study created in memory with name: no-name-5cfae2b2-f3f6-4442-ad7e-b9faa7831874
[I 2023-09-17 20:28:21,426] Trial 0 finished with value: 0.6036806440353394 and parameters: {'n_layers': 3, 'n_units_l0': 6, 'dropout_0': 0.35767830499507347, 'n_units_l1': 9, 'dropout_1': 0.25851628790844605, 'n_units_l2': 3, 'dropout_2': 0.11705491556063968, 'learning_rate': 0.07884534111028364, 'optimizer': 'Adam'}. Best is trial 0 with value: 0.6036806440353394.
[I 2023-09-17 20:29:57,888] Trial 1 finished with value: 0.4017642411200897 and parameters: {'n_layers': 3, 'n_units_l0': 3, 'dropout_0': 0.25642288293141147, 'n_units_l1': 4, 'dropout_1': 0.3531980052761179, 'n_units_l2': 5, 'dropout_2': 0.3438310259365812, 'learning_rate': 0.003351517464161911, 'optimizer': 'RMSprop'}. Best is trial 1 with value: 0.4017642411200897.
[I 2023-09-17 20:31:34,101] Trial 2 finished with value: 0.6895126945557802 and parameters: {'n_layers': 3, 'n_units_l0': 3, 'dropout_0': 0.2744920704560408, 'n_units_l1': 2, 'dropout_1': 0.10983135892358155, 'n_units_l2': 7, 'dropout_2': 0.39357543605746703, 'learning_rate': 0.0889283237882913, 'optimizer': 'RMSprop'}. Best is trial 1 with value: 0.4017642411200897.
[I 2023-09-17 20:33:10,204] Trial 3 finished with value: 0.6905845818830574 and parameters: {'n_layers': 3, 'n_units_l0': 4, 'dropout_0': 0.13969532811078558, 'n_units_l1': 7, 'dropout_1': 0.2140614947054775, 'n_units_l2': 5, 'dropout_2': 0.28603104316138694, 'learning_rate': 0.07366511030284267, 'optimizer': 'RMSprop'}. Best is trial 1 with value: 0.4017642411200897.
[I 2023-09-17 20:34:45,455] Trial 4 finished with value: 0.4000614880997202 and parameters: {'n_layers': 3, 'n_units_l0': 3, 'dropout_0': 0.24887413435845626, 'n_units_l1': 5, 'dropout_1': 0.21944145785384814, 'n_units_l2': 8, 'dropout_2': 0.23828428684662684, 'learning_rate': 0.048891133614131846, 'optimizer': 'SGD'}. Best is trial 4 with value: 0.4000614880997202.
[I 2023-09-17 20:36:16,828] Trial 5 finished with value: 0.32111813016559765 and parameters: {'n_layers': 1, 'n_units_l0': 6, 'dropout_0': 0.2534248547385461, 'learning_rate': 0.06045919811263574, 'optimizer': 'SGD'}. Best is trial 5 with value: 0.32111813016559765.
[I 2023-09-17 20:36:18,822] Trial 6 pruned.
[I 2023-09-17 20:37:57,288] Trial 7 finished with value: 0.4305999175102814 and parameters: {'n_layers': 3, 'n_units_l0': 7, 'dropout_0': 0.17330260655207422, 'n_units_l1': 7, 'dropout_1': 0.2001628634633837, 'n_units_l2': 9, 'dropout_2': 0.22519601438761444, 'learning_rate': 0.0835811715704442, 'optimizer': 'Adam'}. Best is trial 5 with value: 0.32111813016559765.
[I 2023-09-17 20:39:30,867] Trial 8 finished with value: 0.34390849507373306 and parameters: {'n_layers': 2, 'n_units_l0': 4, 'dropout_0': 0.11218159634776634, 'n_units_l1': 4, 'dropout_1': 0.29253762194028843, 'learning_rate': 0.01122248949322228, 'optimizer': 'RMSprop'}. Best is trial 5 with value: 0.32111813016559765.
[I 2023-09-17 20:41:03,477] Trial 9 finished with value: 0.2777217761718709 and parameters: {'n_layers': 1, 'n_units_l0': 8, 'dropout_0': 0.10902798141865566, 'learning_rate': 0.023199215800932056, 'optimizer': 'Adam'}. Best is trial 9 with value: 0.2777217761718709.
Selected Catagories are:
['LPS_0.100_DMSO_0.025' 'Thapsigargin_10.000_DMSO_0.025']
The dimensions of the data are: (305581, 1270)
Number of total missing values across all columns: 611162
Data Subset Is Off
Wells held out for testing: ['C08' 'L06']
Wells to use for training, validation, and testing ['C02' 'C03' 'C09' 'E06' 'E07' 'L07']
Number of in features:  1245
Number of out features:  2
Binary_Classification
cpu
Validation Accuracy: 88.58331118788203
Validation Loss: 0.271045798594537
Training Accuracy: 87.32742784695192
Training Loss: 0.28264444497738095
completed
