[NbConvertApp] WARNING | Config option `kernel_spec_manager_class` not recognized by `NbConvertApp`.
[NbConvertApp] Converting notebook ../notebooks/Hyperparameter_Optimization_model_binary.ipynb to script
[NbConvertApp] Writing 8579 bytes to Hyperparameter_Optimization_model_binary.py
cell_type: PBMC control_name: Flagellin_0.100_DMSO_0.025 treatment_name: LPS_1.000_DMSO_0.025
[I 2023-09-17 20:19:19,698] A new study created in memory with name: no-name-d19cf43f-6c98-4673-9972-9f718307d0f6
[I 2023-09-17 20:20:16,444] Trial 0 finished with value: 0.6629077395270851 and parameters: {'n_layers': 2, 'n_units_l0': 2, 'dropout_0': 0.3268288490261382, 'n_units_l1': 2, 'dropout_1': 0.3866158376195151, 'learning_rate': 0.06034339186752074, 'optimizer': 'Adam'}. Best is trial 0 with value: 0.6629077395270851.
[I 2023-09-17 20:21:11,858] Trial 1 finished with value: 0.5261935125379 and parameters: {'n_layers': 1, 'n_units_l0': 3, 'dropout_0': 0.3705527766685073, 'learning_rate': 0.043466627460513094, 'optimizer': 'Adam'}. Best is trial 1 with value: 0.5261935125379.
[I 2023-09-17 20:22:11,702] Trial 2 finished with value: 0.49435241138233865 and parameters: {'n_layers': 3, 'n_units_l0': 7, 'dropout_0': 0.10909855216439512, 'n_units_l1': 3, 'dropout_1': 0.15792683737126456, 'n_units_l2': 10, 'dropout_2': 0.3224421035559224, 'learning_rate': 0.026222559887870537, 'optimizer': 'Adam'}. Best is trial 2 with value: 0.49435241138233865.
[I 2023-09-17 20:23:06,092] Trial 3 finished with value: 0.5206700483139823 and parameters: {'n_layers': 1, 'n_units_l0': 4, 'dropout_0': 0.3669030367079945, 'learning_rate': 0.05128151514321953, 'optimizer': 'SGD'}. Best is trial 2 with value: 0.49435241138233865.
[I 2023-09-17 20:24:03,228] Trial 4 finished with value: 0.6628832489602706 and parameters: {'n_layers': 2, 'n_units_l0': 7, 'dropout_0': 0.226002765081479, 'n_units_l1': 3, 'dropout_1': 0.3068224889407502, 'learning_rate': 0.021045521855375848, 'optimizer': 'RMSprop'}. Best is trial 2 with value: 0.49435241138233865.
[I 2023-09-17 20:24:04,398] Trial 5 pruned.
[I 2023-09-17 20:25:01,834] Trial 6 finished with value: 0.5185237349131527 and parameters: {'n_layers': 2, 'n_units_l0': 3, 'dropout_0': 0.3632964090142736, 'n_units_l1': 7, 'dropout_1': 0.23095420990785212, 'learning_rate': 0.033642310359994855, 'optimizer': 'Adam'}. Best is trial 2 with value: 0.49435241138233865.
[I 2023-09-17 20:25:03,013] Trial 7 pruned.
[I 2023-09-17 20:25:04,131] Trial 8 pruned.
[I 2023-09-17 20:25:09,827] Trial 9 pruned.
Selected Catagories are:
['LPS_1.000_DMSO_0.025' 'Flagellin_0.100_DMSO_0.025']
The dimensions of the data are: (235348, 1270)
Number of total missing values across all columns: 470696
Data Subset Is Off
Wells held out for testing: ['D09' 'L10']
Wells to use for training, validation, and testing ['D02' 'D03' 'D08' 'L05' 'L11']
Number of in features:  1245
Number of out features:  2
Binary_Classification
cpu
Validation Accuracy: 71.71509150915091
Validation Loss: 0.5089664419608958
Training Accuracy: 68.47886288628862
Training Loss: 0.5504632797081078
completed
