[NbConvertApp] WARNING | Config option `kernel_spec_manager_class` not recognized by `NbConvertApp`.
[NbConvertApp] Converting notebook ../notebooks/Hyperparameter_Optimization_model_binary.ipynb to script
[NbConvertApp] Writing 8579 bytes to Hyperparameter_Optimization_model_binary.py
cell_type: SHSY5Y control_name: Thapsigargin_10.000_DMSO_0.025 treatment_name: Thapsigargin_1.000_DMSO_0.025
[I 2023-09-17 20:35:27,455] A new study created in memory with name: no-name-50076d83-95d3-4dff-a0c6-32afb2b06cfc
[I 2023-09-17 20:35:35,935] Trial 0 finished with value: 0.5128624894221624 and parameters: {'n_layers': 1, 'n_units_l0': 8, 'dropout_0': 0.27484233551390896, 'learning_rate': 0.06843238108995536, 'optimizer': 'SGD'}. Best is trial 0 with value: 0.5128624894221624.
[I 2023-09-17 20:35:44,426] Trial 1 finished with value: 0.5351181869705518 and parameters: {'n_layers': 1, 'n_units_l0': 7, 'dropout_0': 0.16304797538217045, 'learning_rate': 0.03236883215673365, 'optimizer': 'Adam'}. Best is trial 0 with value: 0.5128624894221624.
[I 2023-09-17 20:35:53,002] Trial 2 finished with value: 0.6561102036635081 and parameters: {'n_layers': 3, 'n_units_l0': 6, 'dropout_0': 0.21805837780775889, 'n_units_l1': 8, 'dropout_1': 0.10757380550914537, 'n_units_l2': 3, 'dropout_2': 0.32293632581725384, 'learning_rate': 0.07015833939053867, 'optimizer': 'RMSprop'}. Best is trial 0 with value: 0.5128624894221624.
[I 2023-09-17 20:36:01,303] Trial 3 finished with value: 0.6089005702733994 and parameters: {'n_layers': 1, 'n_units_l0': 9, 'dropout_0': 0.1423151408903951, 'learning_rate': 0.01299820109387602, 'optimizer': 'RMSprop'}. Best is trial 0 with value: 0.5128624894221624.
[I 2023-09-17 20:36:09,726] Trial 4 finished with value: 0.7412060844898224 and parameters: {'n_layers': 1, 'n_units_l0': 10, 'dropout_0': 0.2910733749965195, 'learning_rate': 0.09280858052500217, 'optimizer': 'RMSprop'}. Best is trial 0 with value: 0.5128624894221624.
[I 2023-09-17 20:36:09,866] Trial 5 pruned.
[I 2023-09-17 20:36:10,019] Trial 6 pruned.
[I 2023-09-17 20:36:18,330] Trial 7 finished with value: 0.4959425942103068 and parameters: {'n_layers': 1, 'n_units_l0': 10, 'dropout_0': 0.156365509640214, 'learning_rate': 0.08399135452346944, 'optimizer': 'SGD'}. Best is trial 7 with value: 0.4959425942103068.
[I 2023-09-17 20:36:18,476] Trial 8 pruned.
[I 2023-09-17 20:36:18,624] Trial 9 pruned.
Selected Catagories are:
['Thapsigargin_1.000_DMSO_0.025' 'Thapsigargin_10.000_DMSO_0.025']
The dimensions of the data are: (26978, 1276)
Number of total missing values across all columns: 53956
Data Subset Is Off
Wells held out for testing: ['E14' 'K14']
Wells to use for training, validation, and testing ['D14' 'D15' 'E15' 'L14' 'K15' 'L15']
Number of in features:  1251
Number of out features:  2
Binary_Classification
cpu
Validation Accuracy: 73.56349206349206
Validation Loss: 0.4957981850703558
Training Accuracy: 77.51597097314396
Training Loss: 0.45142356706016207
completed
