[NbConvertApp] WARNING | Config option `kernel_spec_manager_class` not recognized by `NbConvertApp`.
[NbConvertApp] Converting notebook ../notebooks/Hyperparameter_Optimization_model_binary.ipynb to script
[NbConvertApp] Writing 8579 bytes to Hyperparameter_Optimization_model_binary.py
cell_type: SHSY5Y control_name: Flagellin_1.000_DMSO_0.025 treatment_name: LPS_1.000_DMSO_0.025
[I 2023-09-19 01:13:56,549] A new study created in memory with name: no-name-6ebbdb3f-8246-41c2-86ff-11396e485a1a
[I 2023-09-19 01:14:06,377] Trial 0 finished with value: 0.6070966776212058 and parameters: {'n_layers': 2, 'n_units_l0': 7, 'dropout_0': 0.31718013555136293, 'n_units_l1': 4, 'dropout_1': 0.1952309904515242, 'learning_rate': 0.08638135661702402, 'optimizer': 'SGD'}. Best is trial 0 with value: 0.6070966776212058.
[I 2023-09-19 01:14:16,330] Trial 1 finished with value: 0.6108678956826528 and parameters: {'n_layers': 3, 'n_units_l0': 2, 'dropout_0': 0.1727701507155291, 'n_units_l1': 5, 'dropout_1': 0.3044941403864374, 'n_units_l2': 5, 'dropout_2': 0.13431603355308372, 'learning_rate': 0.0025342407732095343, 'optimizer': 'RMSprop'}. Best is trial 0 with value: 0.6070966776212058.
[I 2023-09-19 01:14:26,059] Trial 2 finished with value: 0.558009315331777 and parameters: {'n_layers': 1, 'n_units_l0': 2, 'dropout_0': 0.3521610400526758, 'learning_rate': 0.0033002404183666003, 'optimizer': 'Adam'}. Best is trial 2 with value: 0.558009315331777.
[I 2023-09-19 01:14:35,572] Trial 3 finished with value: 0.6645011274019877 and parameters: {'n_layers': 2, 'n_units_l0': 2, 'dropout_0': 0.3263160104200433, 'n_units_l1': 9, 'dropout_1': 0.38651113688520256, 'learning_rate': 0.040319296985885704, 'optimizer': 'SGD'}. Best is trial 2 with value: 0.558009315331777.
[I 2023-09-19 01:14:45,605] Trial 4 finished with value: 0.6924845182895661 and parameters: {'n_layers': 2, 'n_units_l0': 7, 'dropout_0': 0.28384762166132316, 'n_units_l1': 8, 'dropout_1': 0.22582374152990373, 'learning_rate': 0.06469766555797718, 'optimizer': 'Adam'}. Best is trial 2 with value: 0.558009315331777.
[I 2023-09-19 01:14:45,777] Trial 5 pruned.
[I 2023-09-19 01:14:46,217] Trial 6 pruned.
[I 2023-09-19 01:14:46,390] Trial 7 pruned.
[I 2023-09-19 01:14:46,563] Trial 8 pruned.
[I 2023-09-19 01:14:46,829] Trial 9 pruned.
Selected Catagories are:
['LPS_1.000_DMSO_0.025' 'Flagellin_1.000_DMSO_0.025']
The dimensions of the data are: (32267, 1276)
Number of total missing values across all columns: 64534
Data Subset Is Off
Wells held out for testing: ['D21' 'M22']
Wells to use for training, validation, and testing ['D16' 'D17' 'D20' 'M18' 'M19' 'M23']
Number of in features:  1251
Number of out features:  2
Binary_Classification
cpu
Validation Accuracy: 69.429510891903
Validation Loss: 0.5614557671546936
Training Accuracy: 65.01197266327527
Training Loss: 0.5688282333910465
completed
