[NbConvertApp] WARNING | Config option `kernel_spec_manager_class` not recognized by `NbConvertApp`.
[NbConvertApp] Converting notebook ../notebooks/Hyperparameter_Optimization_model_binary.ipynb to script
[NbConvertApp] Writing 8579 bytes to Hyperparameter_Optimization_model_binary.py
cell_type: PBMC control_name: LPS_0.010_DMSO_0.025 treatment_name: LPS_Nigericin_1.000_3.0_DMSO_0.025
[I 2023-09-19 01:00:48,998] A new study created in memory with name: no-name-879a9b6a-f2b5-45b8-ae31-a3a6c9306072
[I 2023-09-19 01:02:12,455] Trial 0 finished with value: 0.14731485099792482 and parameters: {'n_layers': 1, 'n_units_l0': 6, 'dropout_0': 0.24226698872438535, 'learning_rate': 0.06605507332997403, 'optimizer': 'SGD'}. Best is trial 0 with value: 0.14731485099792482.
[I 2023-09-19 01:03:41,045] Trial 1 finished with value: 0.23172227507233623 and parameters: {'n_layers': 3, 'n_units_l0': 5, 'dropout_0': 0.19710987770708635, 'n_units_l1': 5, 'dropout_1': 0.1707094533566736, 'n_units_l2': 8, 'dropout_2': 0.19857323355710005, 'learning_rate': 0.07852226662592393, 'optimizer': 'Adam'}. Best is trial 0 with value: 0.14731485099792482.
[I 2023-09-19 01:05:08,326] Trial 2 finished with value: 0.25699214488267896 and parameters: {'n_layers': 3, 'n_units_l0': 4, 'dropout_0': 0.12772567201277324, 'n_units_l1': 9, 'dropout_1': 0.1790218640942883, 'n_units_l2': 9, 'dropout_2': 0.11425805254819225, 'learning_rate': 0.006627358703873135, 'optimizer': 'SGD'}. Best is trial 0 with value: 0.14731485099792482.
[I 2023-09-19 01:06:33,606] Trial 3 finished with value: 0.14066358706355095 and parameters: {'n_layers': 2, 'n_units_l0': 9, 'dropout_0': 0.2315767164362669, 'n_units_l1': 9, 'dropout_1': 0.34529335828107693, 'learning_rate': 0.07723181119664331, 'optimizer': 'SGD'}. Best is trial 3 with value: 0.14066358706355095.
[I 2023-09-19 01:08:01,520] Trial 4 finished with value: 0.4611632822036743 and parameters: {'n_layers': 3, 'n_units_l0': 6, 'dropout_0': 0.1559584431668944, 'n_units_l1': 2, 'dropout_1': 0.16447904667175334, 'n_units_l2': 8, 'dropout_2': 0.37637381552701754, 'learning_rate': 0.04534626425518673, 'optimizer': 'RMSprop'}. Best is trial 3 with value: 0.14066358706355095.
[I 2023-09-19 01:08:03,101] Trial 5 pruned.
[I 2023-09-19 01:09:28,796] Trial 6 finished with value: 0.11193228000998498 and parameters: {'n_layers': 1, 'n_units_l0': 10, 'dropout_0': 0.15144579042821985, 'learning_rate': 0.010941183747733823, 'optimizer': 'Adam'}. Best is trial 6 with value: 0.11193228000998498.
[I 2023-09-19 01:10:54,073] Trial 7 finished with value: 0.17234128783345223 and parameters: {'n_layers': 1, 'n_units_l0': 9, 'dropout_0': 0.11227477325566138, 'learning_rate': 0.09709868061291005, 'optimizer': 'Adam'}. Best is trial 6 with value: 0.11193228000998498.
[I 2023-09-19 01:10:55,737] Trial 8 pruned.
[I 2023-09-19 01:12:23,963] Trial 9 finished with value: 0.14003050455451013 and parameters: {'n_layers': 2, 'n_units_l0': 7, 'dropout_0': 0.23163458880378943, 'n_units_l1': 3, 'dropout_1': 0.13526006137929386, 'learning_rate': 0.01764624587771132, 'optimizer': 'Adam'}. Best is trial 6 with value: 0.11193228000998498.
Selected Catagories are:
['LPS_0.010_DMSO_0.025' 'LPS_Nigericin_1.000_3.0_DMSO_0.025']
The dimensions of the data are: (317341, 1270)
Number of total missing values across all columns: 286160
Data Subset Is Off
Wells held out for testing: ['B09' 'L09']
Wells to use for training, validation, and testing ['B02' 'B03' 'B08' 'L02' 'L03' 'L08']
Number of in features:  1245
Number of out features:  2
Binary_Classification
cpu
Validation Accuracy: 95.74528263103802
Validation Loss: 0.11629773545861243
Training Accuracy: 95.34828365878725
Training Loss: 0.11644470068277459
completed
