[NbConvertApp] WARNING | Config option `kernel_spec_manager_class` not recognized by `NbConvertApp`.
[NbConvertApp] Converting notebook ../notebooks/Hyperparameter_Optimization_model_binary.ipynb to script
[NbConvertApp] Writing 8579 bytes to Hyperparameter_Optimization_model_binary.py
cell_type: SHSY5Y control_name: H2O2_100.000_DMSO_0.025 treatment_name: LPS_10.000_DMSO_0.025
[I 2023-09-17 20:17:38,239] A new study created in memory with name: no-name-b7b581cb-f501-4cee-a175-3c83387f4e60
[I 2023-09-17 20:17:53,686] Trial 0 finished with value: 0.4777075305581093 and parameters: {'n_layers': 3, 'n_units_l0': 4, 'dropout_0': 0.18881365323993982, 'n_units_l1': 10, 'dropout_1': 0.268704413945404, 'n_units_l2': 3, 'dropout_2': 0.15886714032881533, 'learning_rate': 0.006242017184553233, 'optimizer': 'RMSprop'}. Best is trial 0 with value: 0.4777075305581093.
[I 2023-09-17 20:18:07,550] Trial 1 finished with value: 0.48380201116204263 and parameters: {'n_layers': 1, 'n_units_l0': 9, 'dropout_0': 0.38887555082875724, 'learning_rate': 0.02694572532034153, 'optimizer': 'SGD'}. Best is trial 0 with value: 0.4777075305581093.
[I 2023-09-17 20:18:21,941] Trial 2 finished with value: 0.46256324514746666 and parameters: {'n_layers': 2, 'n_units_l0': 6, 'dropout_0': 0.1495311758410114, 'n_units_l1': 7, 'dropout_1': 0.20401362050015615, 'learning_rate': 0.05699465201838469, 'optimizer': 'Adam'}. Best is trial 2 with value: 0.46256324514746666.
[I 2023-09-17 20:18:35,691] Trial 3 finished with value: 0.5364794212579728 and parameters: {'n_layers': 1, 'n_units_l0': 8, 'dropout_0': 0.22789280423811534, 'learning_rate': 0.011182636768862077, 'optimizer': 'SGD'}. Best is trial 2 with value: 0.46256324514746666.
[I 2023-09-17 20:18:50,061] Trial 4 finished with value: 0.49209683045744895 and parameters: {'n_layers': 3, 'n_units_l0': 9, 'dropout_0': 0.23334674354509613, 'n_units_l1': 8, 'dropout_1': 0.36027692223941965, 'n_units_l2': 2, 'dropout_2': 0.3069712810625146, 'learning_rate': 0.08797854490344874, 'optimizer': 'SGD'}. Best is trial 2 with value: 0.46256324514746666.
[I 2023-09-17 20:19:03,941] Trial 5 finished with value: 0.46406134650111197 and parameters: {'n_layers': 1, 'n_units_l0': 3, 'dropout_0': 0.3859673636916544, 'learning_rate': 0.06374700051923458, 'optimizer': 'SGD'}. Best is trial 2 with value: 0.46256324514746666.
[I 2023-09-17 20:19:05,645] Trial 6 pruned.
[I 2023-09-17 20:19:20,073] Trial 7 finished with value: 0.46431499376893043 and parameters: {'n_layers': 2, 'n_units_l0': 4, 'dropout_0': 0.1871994905996091, 'n_units_l1': 10, 'dropout_1': 0.10155380999615367, 'learning_rate': 0.07799185873748775, 'optimizer': 'SGD'}. Best is trial 2 with value: 0.46256324514746666.
[I 2023-09-17 20:19:20,339] Trial 8 pruned.
[I 2023-09-17 20:19:35,445] Trial 9 finished with value: 0.46441585436463356 and parameters: {'n_layers': 3, 'n_units_l0': 4, 'dropout_0': 0.3850763718321687, 'n_units_l1': 9, 'dropout_1': 0.37164792562505544, 'n_units_l2': 5, 'dropout_2': 0.23581819734020595, 'learning_rate': 0.00532912870323844, 'optimizer': 'Adam'}. Best is trial 2 with value: 0.46256324514746666.
Selected Catagories are:
['LPS_10.000_DMSO_0.025' 'H2O2_100.000_DMSO_0.025']
The dimensions of the data are: (43710, 1276)
Number of total missing values across all columns: 87420
Data Subset Is Off
Wells held out for testing: ['E21' 'H22']
Wells to use for training, validation, and testing ['E16' 'E17' 'H18' 'H19' 'E20' 'H23' 'I18' 'I19' 'I22' 'I23']
Number of in features:  1251
Number of out features:  2
Binary_Classification
cpu
Validation Accuracy: 77.24660633484163
Validation Loss: 0.46385454908013346
Training Accuracy: 80.25757415066992
Training Loss: 0.4038941420768869
completed
