[NbConvertApp] WARNING | Config option `kernel_spec_manager_class` not recognized by `NbConvertApp`.
[NbConvertApp] Converting notebook ../notebooks/Hyperparameter_Optimization_model_binary.ipynb to script
[NbConvertApp] Writing 8579 bytes to Hyperparameter_Optimization_model_binary.py
cell_type: PBMC control_name: Thapsigargin_1.000_DMSO_0.025 treatment_name: LPS_0.100_DMSO_0.025
[I 2023-09-19 01:21:45,163] A new study created in memory with name: no-name-343f12d5-d4c8-42cd-8b1c-b3e490221c0e
[I 2023-09-19 01:23:05,937] Trial 0 finished with value: 0.8729314549402757 and parameters: {'n_layers': 1, 'n_units_l0': 7, 'dropout_0': 0.35492898945021334, 'learning_rate': 0.09199799779003173, 'optimizer': 'RMSprop'}. Best is trial 0 with value: 0.8729314549402757.
[I 2023-09-19 01:24:25,770] Trial 1 finished with value: 0.4987552830305965 and parameters: {'n_layers': 1, 'n_units_l0': 4, 'dropout_0': 0.15337577595173996, 'learning_rate': 0.08355858970529778, 'optimizer': 'Adam'}. Best is trial 1 with value: 0.4987552830305965.
[I 2023-09-19 01:25:46,591] Trial 2 finished with value: 0.5689320902390914 and parameters: {'n_layers': 2, 'n_units_l0': 2, 'dropout_0': 0.34642009943806834, 'n_units_l1': 3, 'dropout_1': 0.2271747363605539, 'learning_rate': 0.05352813737815733, 'optimizer': 'SGD'}. Best is trial 1 with value: 0.4987552830305965.
[I 2023-09-19 01:27:08,184] Trial 3 finished with value: 0.5214274453845892 and parameters: {'n_layers': 3, 'n_units_l0': 5, 'dropout_0': 0.2571582852843798, 'n_units_l1': 7, 'dropout_1': 0.24625597836127897, 'n_units_l2': 2, 'dropout_2': 0.3515833547482403, 'learning_rate': 0.06300796711779327, 'optimizer': 'SGD'}. Best is trial 1 with value: 0.4987552830305965.
[I 2023-09-19 01:28:30,119] Trial 4 finished with value: 0.523040859428319 and parameters: {'n_layers': 2, 'n_units_l0': 7, 'dropout_0': 0.34536522543020154, 'n_units_l1': 8, 'dropout_1': 0.11216802830363992, 'learning_rate': 0.01729330679332264, 'optimizer': 'SGD'}. Best is trial 1 with value: 0.4987552830305965.
[I 2023-09-19 01:29:55,036] Trial 5 finished with value: 0.415674174157056 and parameters: {'n_layers': 3, 'n_units_l0': 8, 'dropout_0': 0.19604108433735534, 'n_units_l1': 9, 'dropout_1': 0.34835008979064735, 'n_units_l2': 6, 'dropout_2': 0.2923134326993991, 'learning_rate': 0.000422819950096719, 'optimizer': 'Adam'}. Best is trial 5 with value: 0.415674174157056.
[I 2023-09-19 01:31:15,689] Trial 6 finished with value: 0.43702031466093927 and parameters: {'n_layers': 1, 'n_units_l0': 8, 'dropout_0': 0.2823952469342209, 'learning_rate': 0.08231220971143997, 'optimizer': 'Adam'}. Best is trial 5 with value: 0.415674174157056.
[I 2023-09-19 01:32:06,648] Trial 7 pruned.
[I 2023-09-19 01:33:26,295] Trial 8 finished with value: 0.4655084971406243 and parameters: {'n_layers': 1, 'n_units_l0': 6, 'dropout_0': 0.36771201632581174, 'learning_rate': 0.08411049512289943, 'optimizer': 'SGD'}. Best is trial 5 with value: 0.415674174157056.
[I 2023-09-19 01:33:27,958] Trial 9 pruned.
Selected Catagories are:
['LPS_0.100_DMSO_0.025' 'Thapsigargin_1.000_DMSO_0.025']
The dimensions of the data are: (287053, 1270)
Number of total missing values across all columns: 574106
Data Subset Is Off
Wells held out for testing: ['C08' 'K06']
Wells to use for training, validation, and testing ['C02' 'C03' 'C09' 'D06' 'D07' 'K07']
Number of in features:  1245
Number of out features:  2
Binary_Classification
cpu
Validation Accuracy: 80.70323606434718
Validation Loss: 0.4174225801771337
Training Accuracy: 77.75591876819473
Training Loss: 0.4678809592682262
completed
