[NbConvertApp] WARNING | Config option `kernel_spec_manager_class` not recognized by `NbConvertApp`.
[NbConvertApp] Converting notebook ../notebooks/Hyperparameter_Optimization_model_binary.ipynb to script
[NbConvertApp] Writing 8579 bytes to Hyperparameter_Optimization_model_binary.py
cell_type: PBMC control_name: LPS_Nigericin_1.000_10.0_DMSO_0.025 treatment_name: LPS_0.100_DMSO_0.025
[I 2023-09-19 01:20:28,428] A new study created in memory with name: no-name-5e4a18d5-674c-409f-b520-9036390973ab
[I 2023-09-19 01:22:02,284] Trial 0 finished with value: 0.19267214975009359 and parameters: {'n_layers': 3, 'n_units_l0': 10, 'dropout_0': 0.2260634711309902, 'n_units_l1': 4, 'dropout_1': 0.3772592610383215, 'n_units_l2': 8, 'dropout_2': 0.3519809958552371, 'learning_rate': 0.02094291558196647, 'optimizer': 'RMSprop'}. Best is trial 0 with value: 0.19267214975009359.
[I 2023-09-19 01:23:29,586] Trial 1 finished with value: 0.18188723598917328 and parameters: {'n_layers': 1, 'n_units_l0': 10, 'dropout_0': 0.3737130003839557, 'learning_rate': 0.03810760392883702, 'optimizer': 'SGD'}. Best is trial 1 with value: 0.18188723598917328.
[I 2023-09-19 01:25:00,504] Trial 2 finished with value: 0.2576864586398005 and parameters: {'n_layers': 2, 'n_units_l0': 2, 'dropout_0': 0.2390543016032119, 'n_units_l1': 7, 'dropout_1': 0.37512037416624233, 'learning_rate': 0.017460594023331753, 'optimizer': 'Adam'}. Best is trial 1 with value: 0.18188723598917328.
[I 2023-09-19 01:26:35,813] Trial 3 finished with value: 0.6315961353729168 and parameters: {'n_layers': 3, 'n_units_l0': 7, 'dropout_0': 0.14386834695022802, 'n_units_l1': 8, 'dropout_1': 0.3451626996685382, 'n_units_l2': 4, 'dropout_2': 0.33028620703719, 'learning_rate': 0.08010871674251929, 'optimizer': 'Adam'}. Best is trial 1 with value: 0.18188723598917328.
[I 2023-09-19 01:28:08,643] Trial 4 finished with value: 0.301493930829068 and parameters: {'n_layers': 2, 'n_units_l0': 7, 'dropout_0': 0.363250826200164, 'n_units_l1': 4, 'dropout_1': 0.18588293368443698, 'learning_rate': 0.08705686660817923, 'optimizer': 'Adam'}. Best is trial 1 with value: 0.18188723598917328.
[I 2023-09-19 01:28:15,892] Trial 5 pruned.
[I 2023-09-19 01:28:41,926] Trial 6 pruned.
[I 2023-09-19 01:30:09,713] Trial 7 finished with value: 0.18100125112881266 and parameters: {'n_layers': 1, 'n_units_l0': 9, 'dropout_0': 0.27240988499946817, 'learning_rate': 0.03079578150586305, 'optimizer': 'RMSprop'}. Best is trial 7 with value: 0.18100125112881266.
[I 2023-09-19 01:30:11,381] Trial 8 pruned.
[I 2023-09-19 01:31:39,271] Trial 9 finished with value: 0.1785522905612985 and parameters: {'n_layers': 1, 'n_units_l0': 9, 'dropout_0': 0.38998015594121793, 'learning_rate': 0.04434431038586302, 'optimizer': 'Adam'}. Best is trial 9 with value: 0.1785522905612985.
Selected Catagories are:
['LPS_0.100_DMSO_0.025' 'LPS_Nigericin_1.000_10.0_DMSO_0.025']
The dimensions of the data are: (319763, 1270)
Number of total missing values across all columns: 277194
Data Subset Is Off
Wells held out for testing: ['C09' 'M09']
Wells to use for training, validation, and testing ['C02' 'C03' 'C08' 'M02' 'M03' 'M08']
Number of in features:  1245
Number of out features:  2
Binary_Classification
cpu
Validation Accuracy: 93.47508191067425
Validation Loss: 0.18499385508398214
Training Accuracy: 90.84447581992391
Training Loss: 0.23897115444624295
completed
