[NbConvertApp] WARNING | Config option `kernel_spec_manager_class` not recognized by `NbConvertApp`.
[NbConvertApp] Converting notebook ../notebooks/Hyperparameter_Optimization_model_binary.ipynb to script
[NbConvertApp] Writing 8579 bytes to Hyperparameter_Optimization_model_binary.py
cell_type: PBMC control_name: Thapsigargin_10.000_DMSO_0.025 treatment_name: LPS_100.000_DMSO_0.025
[I 2023-09-17 20:14:30,323] A new study created in memory with name: no-name-de42beb3-071b-4746-91cf-9d3c5a1dbe12
[I 2023-09-17 20:16:02,692] Trial 0 finished with value: 0.6860999559402464 and parameters: {'n_layers': 3, 'n_units_l0': 10, 'dropout_0': 0.22092658374701632, 'n_units_l1': 5, 'dropout_1': 0.3355089425007446, 'n_units_l2': 8, 'dropout_2': 0.17789450612077617, 'learning_rate': 0.07524503642747214, 'optimizer': 'Adam'}. Best is trial 0 with value: 0.6860999559402464.
[I 2023-09-17 20:17:30,123] Trial 1 finished with value: 0.2250114806056023 and parameters: {'n_layers': 1, 'n_units_l0': 10, 'dropout_0': 0.20222959123118894, 'learning_rate': 0.017918748950393856, 'optimizer': 'Adam'}. Best is trial 1 with value: 0.2250114806056023.
[I 2023-09-17 20:19:00,666] Trial 2 finished with value: 0.6932432013988497 and parameters: {'n_layers': 3, 'n_units_l0': 10, 'dropout_0': 0.26700599518539075, 'n_units_l1': 2, 'dropout_1': 0.2345496040419925, 'n_units_l2': 3, 'dropout_2': 0.3694443881616317, 'learning_rate': 0.03525141656908056, 'optimizer': 'RMSprop'}. Best is trial 1 with value: 0.2250114806056023.
[I 2023-09-17 20:20:26,586] Trial 3 finished with value: 0.3064152945756912 and parameters: {'n_layers': 1, 'n_units_l0': 10, 'dropout_0': 0.2279001049959058, 'learning_rate': 0.014118880281410735, 'optimizer': 'SGD'}. Best is trial 1 with value: 0.2250114806056023.
[I 2023-09-17 20:21:56,644] Trial 4 finished with value: 0.2761602677702904 and parameters: {'n_layers': 3, 'n_units_l0': 8, 'dropout_0': 0.3002163309409815, 'n_units_l1': 5, 'dropout_1': 0.3022276143983709, 'n_units_l2': 9, 'dropout_2': 0.14924698373566664, 'learning_rate': 0.00876654374267751, 'optimizer': 'RMSprop'}. Best is trial 1 with value: 0.2250114806056023.
[I 2023-09-17 20:21:58,475] Trial 5 pruned.
[I 2023-09-17 20:23:26,598] Trial 6 finished with value: 0.2669564651966095 and parameters: {'n_layers': 1, 'n_units_l0': 7, 'dropout_0': 0.38085573799991734, 'learning_rate': 0.0006753821394780912, 'optimizer': 'RMSprop'}. Best is trial 1 with value: 0.2250114806056023.
[I 2023-09-17 20:23:28,404] Trial 7 pruned.
[I 2023-09-17 20:24:57,876] Trial 8 finished with value: 0.23866757318973542 and parameters: {'n_layers': 2, 'n_units_l0': 6, 'dropout_0': 0.12270919409363167, 'n_units_l1': 9, 'dropout_1': 0.36832205151176467, 'learning_rate': 0.014644270003694275, 'optimizer': 'Adam'}. Best is trial 1 with value: 0.2250114806056023.
[I 2023-09-17 20:24:59,639] Trial 9 pruned.
Selected Catagories are:
['Thapsigargin_10.000_DMSO_0.025' 'LPS_100.000_DMSO_0.025']
The dimensions of the data are: (326419, 1270)
Number of total missing values across all columns: 652838
Data Subset Is Off
Wells held out for testing: ['J09' 'L06']
Wells to use for training, validation, and testing ['E06' 'E07' 'J02' 'J03' 'J08' 'L07']
Number of in features:  1245
Number of out features:  2
Binary_Classification
cpu
Validation Accuracy: 90.63818887879039
Validation Loss: 0.22269237763881683
Training Accuracy: 89.38604862531243
Training Loss: 0.24157180145229265
completed
