[NbConvertApp] WARNING | Config option `kernel_spec_manager_class` not recognized by `NbConvertApp`.
[NbConvertApp] Converting notebook ../notebooks/Hyperparameter_Optimization_model_binary.ipynb to script
[NbConvertApp] Writing 8579 bytes to Hyperparameter_Optimization_model_binary.py
cell_type: SHSY5Y control_name: LPS_1.000_DMSO_0.025 treatment_name: LPS_1.000_DMSO_0.025
[I 2023-09-17 20:19:50,843] A new study created in memory with name: no-name-d5eb9597-9813-45ae-af56-074bf06eda8a
[I 2023-09-17 20:19:55,023] Trial 0 finished with value: 3.27954624431661e-05 and parameters: {'n_layers': 3, 'n_units_l0': 4, 'dropout_0': 0.26370389284427864, 'n_units_l1': 6, 'dropout_1': 0.3593577561342519, 'n_units_l2': 4, 'dropout_2': 0.2794500617684094, 'learning_rate': 0.010681632608229663, 'optimizer': 'RMSprop'}. Best is trial 0 with value: 3.27954624431661e-05.
[I 2023-09-17 20:19:58,962] Trial 1 finished with value: 0.001410479512414895 and parameters: {'n_layers': 1, 'n_units_l0': 9, 'dropout_0': 0.3344599258639646, 'learning_rate': 0.06617154227024183, 'optimizer': 'SGD'}. Best is trial 0 with value: 3.27954624431661e-05.
[I 2023-09-17 20:20:03,001] Trial 2 finished with value: 0.04436849556442765 and parameters: {'n_layers': 1, 'n_units_l0': 10, 'dropout_0': 0.21662647825428166, 'learning_rate': 0.06458175831916664, 'optimizer': 'Adam'}. Best is trial 0 with value: 3.27954624431661e-05.
[I 2023-09-17 20:20:07,152] Trial 3 finished with value: 0.0064099339109673584 and parameters: {'n_layers': 2, 'n_units_l0': 8, 'dropout_0': 0.1701135597017268, 'n_units_l1': 5, 'dropout_1': 0.1809003319986039, 'learning_rate': 0.05942581355338926, 'optimizer': 'Adam'}. Best is trial 0 with value: 3.27954624431661e-05.
[I 2023-09-17 20:20:11,086] Trial 4 finished with value: 0.04576903863288852 and parameters: {'n_layers': 1, 'n_units_l0': 9, 'dropout_0': 0.34734377050059706, 'learning_rate': 0.07884967964559453, 'optimizer': 'Adam'}. Best is trial 0 with value: 3.27954624431661e-05.
[I 2023-09-17 20:20:11,456] Trial 5 pruned.
[I 2023-09-17 20:20:11,609] Trial 6 pruned.
[I 2023-09-17 20:20:15,666] Trial 7 finished with value: 0.000185372986306902 and parameters: {'n_layers': 3, 'n_units_l0': 4, 'dropout_0': 0.10383199521015928, 'n_units_l1': 7, 'dropout_1': 0.3840943424931106, 'n_units_l2': 10, 'dropout_2': 0.27438278042682107, 'learning_rate': 0.04312511965997034, 'optimizer': 'SGD'}. Best is trial 0 with value: 3.27954624431661e-05.
[I 2023-09-17 20:20:16,163] Trial 8 pruned.
[I 2023-09-17 20:20:20,125] Trial 9 finished with value: 0.00044315116916550325 and parameters: {'n_layers': 2, 'n_units_l0': 6, 'dropout_0': 0.17440287258177684, 'n_units_l1': 8, 'dropout_1': 0.16762281599421694, 'learning_rate': 0.05379292507629382, 'optimizer': 'SGD'}. Best is trial 0 with value: 3.27954624431661e-05.
Selected Catagories are:
['LPS_1.000_DMSO_0.025']
The dimensions of the data are: (16458, 1276)
Number of total missing values across all columns: 32916
Data Subset Is Off
Wells held out for testing: ['D20']
Wells to use for training, validation, and testing ['D16' 'D17' 'D21']
Number of in features:  1251
Number of out features:  1
Regression
cpu
Validation Loss: 0.0001919907570517715
Training Loss: 0.006665970324447814
completed
