[NbConvertApp] WARNING | Config option `kernel_spec_manager_class` not recognized by `NbConvertApp`.
[NbConvertApp] Converting notebook ../notebooks/Hyperparameter_Optimization_model_binary.ipynb to script
[NbConvertApp] Writing 8579 bytes to Hyperparameter_Optimization_model_binary.py
cell_type: PBMC control_name: LPS_100.000_DMSO_0.025 treatment_name: DMSO_0.100_DMSO_0.025
[I 2023-09-17 19:26:35,603] A new study created in memory with name: no-name-d3a3eac3-9431-4421-8741-568e18dbec9f
[I 2023-09-17 19:29:32,867] Trial 0 finished with value: 0.44588497436815694 and parameters: {'n_layers': 2, 'n_units_l0': 6, 'dropout_0': 0.24370431067246826, 'n_units_l1': 10, 'dropout_1': 0.3823422945173508, 'learning_rate': 0.013087485212571316, 'optimizer': 'SGD'}. Best is trial 0 with value: 0.44588497436815694.
[I 2023-09-17 19:31:57,430] Trial 1 finished with value: 0.6713624008240237 and parameters: {'n_layers': 3, 'n_units_l0': 8, 'dropout_0': 0.30187261008372857, 'n_units_l1': 4, 'dropout_1': 0.10176963430157293, 'n_units_l2': 4, 'dropout_2': 0.3789904212576898, 'learning_rate': 0.03661292426178714, 'optimizer': 'RMSprop'}. Best is trial 0 with value: 0.44588497436815694.
[I 2023-09-17 19:34:17,229] Trial 2 finished with value: 0.351049592841056 and parameters: {'n_layers': 1, 'n_units_l0': 7, 'dropout_0': 0.17222560232693374, 'learning_rate': 0.025748664867859802, 'optimizer': 'RMSprop'}. Best is trial 2 with value: 0.351049592841056.
[I 2023-09-17 19:36:37,488] Trial 3 finished with value: 0.5000332233213609 and parameters: {'n_layers': 2, 'n_units_l0': 7, 'dropout_0': 0.23132345747684327, 'n_units_l1': 5, 'dropout_1': 0.37561787898735244, 'learning_rate': 0.07930058369875062, 'optimizer': 'Adam'}. Best is trial 2 with value: 0.351049592841056.
[I 2023-09-17 19:38:49,147] Trial 4 finished with value: 0.6670029375630041 and parameters: {'n_layers': 3, 'n_units_l0': 2, 'dropout_0': 0.20159048955543074, 'n_units_l1': 2, 'dropout_1': 0.1591120778210424, 'n_units_l2': 10, 'dropout_2': 0.11857398653048545, 'learning_rate': 0.06292821444650902, 'optimizer': 'RMSprop'}. Best is trial 2 with value: 0.351049592841056.
[I 2023-09-17 19:39:45,373] Trial 5 pruned.
[I 2023-09-17 19:42:18,352] Trial 6 finished with value: 0.33284223191199763 and parameters: {'n_layers': 1, 'n_units_l0': 7, 'dropout_0': 0.2849905732680412, 'learning_rate': 0.02630915030566513, 'optimizer': 'Adam'}. Best is trial 6 with value: 0.33284223191199763.
[I 2023-09-17 19:42:21,173] Trial 7 pruned.
[I 2023-09-17 19:44:24,157] Trial 8 finished with value: 0.3803102013564878 and parameters: {'n_layers': 1, 'n_units_l0': 4, 'dropout_0': 0.16381597174903076, 'learning_rate': 0.03413382599834868, 'optimizer': 'RMSprop'}. Best is trial 6 with value: 0.33284223191199763.
[I 2023-09-17 19:46:55,466] Trial 9 finished with value: 0.33127252990199674 and parameters: {'n_layers': 2, 'n_units_l0': 10, 'dropout_0': 0.3056576374581575, 'n_units_l1': 6, 'dropout_1': 0.2875291212816392, 'learning_rate': 0.02194060475668755, 'optimizer': 'Adam'}. Best is trial 9 with value: 0.33127252990199674.
Selected Catagories are:
['DMSO_0.100_DMSO_0.025' 'LPS_100.000_DMSO_0.025']
The dimensions of the data are: (374565, 1270)
Number of total missing values across all columns: 749130
Data Subset Is Off
Wells held out for testing: ['J06' 'J08']
Wells to use for training, validation, and testing ['B06' 'C06' 'B07' 'C07' 'I06' 'I07' 'J02' 'J03' 'J07' 'J09']
Number of in features:  1245
Number of out features:  2
Binary_Classification
cpu
Validation Accuracy: 85.41521563560008
Validation Loss: 0.33165024347843663
Training Accuracy: 82.91971345270113
Training Loss: 0.3814159703495041
completed
