[NbConvertApp] WARNING | Config option `kernel_spec_manager_class` not recognized by `NbConvertApp`.
[NbConvertApp] Converting notebook ../notebooks/Hyperparameter_Optimization_model_binary.ipynb to script
[NbConvertApp] Writing 8579 bytes to Hyperparameter_Optimization_model_binary.py
cell_type: PBMC control_name: Thapsigargin_1.000_DMSO_0.025 treatment_name: LPS_1.000_DMSO_0.025
[I 2023-09-17 20:22:11,868] A new study created in memory with name: no-name-f29d83e7-21e5-4a4f-9645-118efb754f7f
[I 2023-09-17 20:23:21,469] Trial 0 finished with value: 0.4471830408346086 and parameters: {'n_layers': 2, 'n_units_l0': 5, 'dropout_0': 0.3744450714105433, 'n_units_l1': 7, 'dropout_1': 0.30374638603699644, 'learning_rate': 0.03866811075646305, 'optimizer': 'SGD'}. Best is trial 0 with value: 0.4471830408346086.
[I 2023-09-17 20:24:34,347] Trial 1 finished with value: 0.4732083031960896 and parameters: {'n_layers': 2, 'n_units_l0': 7, 'dropout_0': 0.28895817472559326, 'n_units_l1': 7, 'dropout_1': 0.2591121964552653, 'learning_rate': 0.06609332720830843, 'optimizer': 'Adam'}. Best is trial 0 with value: 0.4471830408346086.
[I 2023-09-17 20:25:44,674] Trial 2 finished with value: 0.5364989703325999 and parameters: {'n_layers': 2, 'n_units_l0': 3, 'dropout_0': 0.12397036070693615, 'n_units_l1': 3, 'dropout_1': 0.3263142524629008, 'learning_rate': 0.010185498327571537, 'optimizer': 'SGD'}. Best is trial 0 with value: 0.4471830408346086.
[I 2023-09-17 20:26:56,647] Trial 3 finished with value: 0.44677754118329005 and parameters: {'n_layers': 2, 'n_units_l0': 3, 'dropout_0': 0.3269921301815288, 'n_units_l1': 10, 'dropout_1': 0.36916155243147997, 'learning_rate': 0.019979580766488366, 'optimizer': 'RMSprop'}. Best is trial 3 with value: 0.44677754118329005.
[I 2023-09-17 20:28:06,478] Trial 4 finished with value: 0.5125191498086568 and parameters: {'n_layers': 1, 'n_units_l0': 3, 'dropout_0': 0.14029557802263654, 'learning_rate': 0.06612866486291893, 'optimizer': 'RMSprop'}. Best is trial 3 with value: 0.44677754118329005.
[I 2023-09-17 20:28:07,861] Trial 5 pruned.
[I 2023-09-17 20:28:09,156] Trial 6 pruned.
[I 2023-09-17 20:28:10,656] Trial 7 pruned.
[I 2023-09-17 20:29:19,815] Trial 8 finished with value: 0.3628654140517826 and parameters: {'n_layers': 1, 'n_units_l0': 9, 'dropout_0': 0.22593556989098754, 'learning_rate': 0.07776650161141992, 'optimizer': 'SGD'}. Best is trial 8 with value: 0.3628654140517826.
[I 2023-09-17 20:29:21,284] Trial 9 pruned.
Selected Catagories are:
['LPS_1.000_DMSO_0.025' 'Thapsigargin_1.000_DMSO_0.025']
The dimensions of the data are: (287889, 1270)
Number of total missing values across all columns: 575778
Data Subset Is Off
Wells held out for testing: ['D08' 'K06']
Wells to use for training, validation, and testing ['D02' 'D03' 'D06' 'D07' 'D09' 'K07']
Number of in features:  1245
Number of out features:  2
Binary_Classification
cpu
Validation Accuracy: 83.90441702006005
Validation Loss: 0.35997786675180704
Training Accuracy: 81.58492161814456
Training Loss: 0.39144622271259627
completed
