[NbConvertApp] WARNING | Config option `kernel_spec_manager_class` not recognized by `NbConvertApp`.
[NbConvertApp] Converting notebook ../notebooks/Hyperparameter_Optimization_model_binary.ipynb to script
[NbConvertApp] Writing 8579 bytes to Hyperparameter_Optimization_model_binary.py
cell_type: SHSY5Y control_name: Thapsigargin_1.000_DMSO_0.025 treatment_name: LPS_Nigericin_1.000_3.0_DMSO_0.025
[I 2023-09-17 20:03:18,679] A new study created in memory with name: no-name-d43f3f37-c1df-4a6f-ac7c-1cb008f96129
[I 2023-09-17 20:03:27,609] Trial 0 finished with value: 0.14003955706954002 and parameters: {'n_layers': 3, 'n_units_l0': 5, 'dropout_0': 0.2942505474484198, 'n_units_l1': 4, 'dropout_1': 0.3669320287829917, 'n_units_l2': 4, 'dropout_2': 0.3338453225996623, 'learning_rate': 0.006919630379615506, 'optimizer': 'RMSprop'}. Best is trial 0 with value: 0.14003955706954002.
[I 2023-09-17 20:03:35,797] Trial 1 finished with value: 0.34884624456365915 and parameters: {'n_layers': 1, 'n_units_l0': 9, 'dropout_0': 0.31220723169987, 'learning_rate': 0.06566534942490854, 'optimizer': 'RMSprop'}. Best is trial 0 with value: 0.14003955706954002.
[I 2023-09-17 20:03:44,317] Trial 2 finished with value: 0.16062516535321872 and parameters: {'n_layers': 1, 'n_units_l0': 8, 'dropout_0': 0.37348767235710323, 'learning_rate': 0.08431481988706427, 'optimizer': 'Adam'}. Best is trial 0 with value: 0.14003955706954002.
[I 2023-09-17 20:03:52,652] Trial 3 finished with value: 0.10295082901914915 and parameters: {'n_layers': 1, 'n_units_l0': 5, 'dropout_0': 0.22597699098009214, 'learning_rate': 0.055889055131837125, 'optimizer': 'Adam'}. Best is trial 3 with value: 0.10295082901914915.
[I 2023-09-17 20:04:00,997] Trial 4 finished with value: 0.19606901541352273 and parameters: {'n_layers': 2, 'n_units_l0': 4, 'dropout_0': 0.1417600129111881, 'n_units_l1': 3, 'dropout_1': 0.2556362532870087, 'learning_rate': 0.0580581016744779, 'optimizer': 'RMSprop'}. Best is trial 3 with value: 0.10295082901914915.
[I 2023-09-17 20:04:01,222] Trial 5 pruned.
[I 2023-09-17 20:04:01,368] Trial 6 pruned.
[I 2023-09-17 20:04:01,523] Trial 7 pruned.
[I 2023-09-17 20:04:01,670] Trial 8 pruned.
[I 2023-09-17 20:04:01,822] Trial 9 pruned.
Selected Catagories are:
['Thapsigargin_1.000_DMSO_0.025' 'LPS_Nigericin_1.000_3.0_DMSO_0.025']
The dimensions of the data are: (27418, 1276)
Number of total missing values across all columns: 27532
Data Subset Is Off
Wells held out for testing: ['D14' 'L20']
Wells to use for training, validation, and testing ['D15' 'K14' 'K15' 'L16' 'L17' 'L21']
Number of in features:  1251
Number of out features:  2
Binary_Classification
cpu
Validation Accuracy: 97.53883029721956
Validation Loss: 0.1607184051970641
Training Accuracy: 97.93585516455849
Training Loss: 0.06305904820451841
completed
