[NbConvertApp] WARNING | Config option `kernel_spec_manager_class` not recognized by `NbConvertApp`.
[NbConvertApp] Converting notebook ../notebooks/Hyperparameter_Optimization_model_binary.ipynb to script
[NbConvertApp] Writing 8579 bytes to Hyperparameter_Optimization_model_binary.py
cell_type: SHSY5Y control_name: DMSO_0.100_DMSO_0.025 treatment_name: LPS_10.000_DMSO_0.025
[I 2023-09-19 01:09:20,250] A new study created in memory with name: no-name-8aa78a70-f144-420b-92ee-c1c381680e11
[I 2023-09-19 01:09:37,146] Trial 0 finished with value: 0.487062017917633 and parameters: {'n_layers': 2, 'n_units_l0': 6, 'dropout_0': 0.2684945316300351, 'n_units_l1': 7, 'dropout_1': 0.3983674146061701, 'learning_rate': 0.015566997085431163, 'optimizer': 'RMSprop'}. Best is trial 0 with value: 0.487062017917633.
[I 2023-09-19 01:09:54,669] Trial 1 finished with value: 0.47979341578483586 and parameters: {'n_layers': 3, 'n_units_l0': 7, 'dropout_0': 0.15220226481315205, 'n_units_l1': 6, 'dropout_1': 0.3901445850429246, 'n_units_l2': 9, 'dropout_2': 0.14918172295888613, 'learning_rate': 0.001913425257643614, 'optimizer': 'RMSprop'}. Best is trial 1 with value: 0.47979341578483586.
[I 2023-09-19 01:10:11,292] Trial 2 finished with value: 0.5577001280784607 and parameters: {'n_layers': 2, 'n_units_l0': 10, 'dropout_0': 0.38090199167711514, 'n_units_l1': 8, 'dropout_1': 0.17715430363403184, 'learning_rate': 0.018891455267621086, 'optimizer': 'SGD'}. Best is trial 1 with value: 0.47979341578483586.
[I 2023-09-19 01:10:29,270] Trial 3 finished with value: 0.4826486234664917 and parameters: {'n_layers': 3, 'n_units_l0': 7, 'dropout_0': 0.15060965891712852, 'n_units_l1': 9, 'dropout_1': 0.10345059544784292, 'n_units_l2': 5, 'dropout_2': 0.22782823655721468, 'learning_rate': 0.055944278787428595, 'optimizer': 'Adam'}. Best is trial 1 with value: 0.47979341578483586.
[I 2023-09-19 01:10:45,685] Trial 4 finished with value: 0.47631147289276127 and parameters: {'n_layers': 2, 'n_units_l0': 6, 'dropout_0': 0.3448490324859915, 'n_units_l1': 6, 'dropout_1': 0.12907744092143503, 'learning_rate': 0.08528536160671181, 'optimizer': 'SGD'}. Best is trial 4 with value: 0.47631147289276127.
[I 2023-09-19 01:10:45,973] Trial 5 pruned.
[I 2023-09-19 01:10:46,353] Trial 6 pruned.
[I 2023-09-19 01:10:47,292] Trial 7 pruned.
[I 2023-09-19 01:10:47,685] Trial 8 pruned.
[I 2023-09-19 01:10:50,725] Trial 9 pruned.
Selected Catagories are:
['DMSO_0.100_DMSO_0.025' 'LPS_10.000_DMSO_0.025']
The dimensions of the data are: (52453, 1276)
Number of total missing values across all columns: 104906
Data Subset Is Off
Wells held out for testing: ['E20' 'I14']
Wells to use for training, validation, and testing ['B14' 'C14' 'B15' 'C15' 'E16' 'E17' 'E21' 'J14' 'I15' 'J15']
Number of in features:  1251
Number of out features:  2
Binary_Classification
cpu
Validation Accuracy: 74.1035673187572
Validation Loss: 0.5012088849544525
Training Accuracy: 73.9121928764601
Training Loss: 0.512997015782765
completed
