[NbConvertApp] WARNING | Config option `kernel_spec_manager_class` not recognized by `NbConvertApp`.
[NbConvertApp] Converting notebook ../notebooks/Hyperparameter_Optimization_model_binary.ipynb to script
[NbConvertApp] Writing 8579 bytes to Hyperparameter_Optimization_model_binary.py
cell_type: PBMC control_name: LPS_0.100_DMSO_0.025 treatment_name: LPS_100.000_DMSO_0.025
[I 2023-09-17 20:13:15,812] A new study created in memory with name: no-name-ac2bcfc8-e170-48d8-8f62-519fccf5d3b3
[I 2023-09-17 20:14:37,298] Trial 0 finished with value: 0.6898256674020186 and parameters: {'n_layers': 2, 'n_units_l0': 8, 'dropout_0': 0.16692445592637867, 'n_units_l1': 8, 'dropout_1': 0.35352103161139126, 'learning_rate': 0.07896434399471966, 'optimizer': 'Adam'}. Best is trial 0 with value: 0.6898256674020186.
[I 2023-09-17 20:15:59,375] Trial 1 finished with value: 0.689894243478775 and parameters: {'n_layers': 3, 'n_units_l0': 5, 'dropout_0': 0.33621240398782537, 'n_units_l1': 8, 'dropout_1': 0.11872493530976391, 'n_units_l2': 4, 'dropout_2': 0.16643835630062304, 'learning_rate': 0.04349062818950388, 'optimizer': 'Adam'}. Best is trial 0 with value: 0.6898256674020186.
[I 2023-09-17 20:17:22,994] Trial 2 finished with value: 0.6899117259875589 and parameters: {'n_layers': 3, 'n_units_l0': 8, 'dropout_0': 0.12085226673089963, 'n_units_l1': 2, 'dropout_1': 0.34593778888862403, 'n_units_l2': 9, 'dropout_2': 0.19192378144220532, 'learning_rate': 0.08546742839321611, 'optimizer': 'Adam'}. Best is trial 0 with value: 0.6898256674020186.
[I 2023-09-17 20:18:40,184] Trial 3 finished with value: 0.6154351243247156 and parameters: {'n_layers': 1, 'n_units_l0': 9, 'dropout_0': 0.13055142959248647, 'learning_rate': 0.07789814206261864, 'optimizer': 'SGD'}. Best is trial 3 with value: 0.6154351243247156.
[I 2023-09-17 20:20:03,546] Trial 4 finished with value: 0.6904305428007376 and parameters: {'n_layers': 3, 'n_units_l0': 7, 'dropout_0': 0.30903630565379225, 'n_units_l1': 7, 'dropout_1': 0.3495702020416206, 'n_units_l2': 8, 'dropout_2': 0.39729737541476007, 'learning_rate': 0.09421775455494177, 'optimizer': 'RMSprop'}. Best is trial 3 with value: 0.6154351243247156.
[I 2023-09-17 20:20:05,121] Trial 5 pruned.
[I 2023-09-17 20:21:26,699] Trial 6 finished with value: 0.642798297405243 and parameters: {'n_layers': 3, 'n_units_l0': 10, 'dropout_0': 0.26525603142198917, 'n_units_l1': 4, 'dropout_1': 0.22091834945973082, 'n_units_l2': 5, 'dropout_2': 0.25277499461409053, 'learning_rate': 0.06846595685468392, 'optimizer': 'SGD'}. Best is trial 3 with value: 0.6154351243247156.
[I 2023-09-17 20:21:28,199] Trial 7 pruned.
[I 2023-09-17 20:22:45,883] Trial 8 finished with value: 0.6418229307299075 and parameters: {'n_layers': 1, 'n_units_l0': 4, 'dropout_0': 0.3844803405284919, 'learning_rate': 0.01864953838549713, 'optimizer': 'Adam'}. Best is trial 3 with value: 0.6154351243247156.
[I 2023-09-17 20:24:03,911] Trial 9 finished with value: 0.6233844038196232 and parameters: {'n_layers': 1, 'n_units_l0': 5, 'dropout_0': 0.17794935101783077, 'learning_rate': 0.013310694768409377, 'optimizer': 'Adam'}. Best is trial 3 with value: 0.6154351243247156.
Selected Catagories are:
['LPS_0.100_DMSO_0.025' 'LPS_100.000_DMSO_0.025']
The dimensions of the data are: (298032, 1270)
Number of total missing values across all columns: 596064
Data Subset Is Off
Wells held out for testing: ['C08' 'J08']
Wells to use for training, validation, and testing ['C02' 'C03' 'C09' 'J02' 'J03' 'J09']
Number of in features:  1245
Number of out features:  2
Binary_Classification
cpu
Validation Accuracy: 66.11818865920057
Validation Loss: 0.6114474510109943
Training Accuracy: 66.59079238601151
Training Loss: 0.6039084557867841
completed
