[NbConvertApp] WARNING | Config option `kernel_spec_manager_class` not recognized by `NbConvertApp`.
[NbConvertApp] Converting notebook ../notebooks/Hyperparameter_Optimization_model_binary.ipynb to script
[NbConvertApp] Writing 8579 bytes to Hyperparameter_Optimization_model_binary.py
cell_type: PBMC control_name: LPS_1.000_DMSO_0.025 treatment_name: LPS_10.000_DMSO_0.025
[I 2023-09-19 01:13:07,452] A new study created in memory with name: no-name-dc719270-a9e3-4980-aca8-8ef2c973d723
[I 2023-09-19 01:14:35,013] Trial 0 finished with value: 0.4761984766071493 and parameters: {'n_layers': 1, 'n_units_l0': 3, 'dropout_0': 0.3398975929509248, 'learning_rate': 0.09169188752627067, 'optimizer': 'SGD'}. Best is trial 0 with value: 0.4761984766071493.
[I 2023-09-19 01:16:02,682] Trial 1 finished with value: 0.47032725745981396 and parameters: {'n_layers': 1, 'n_units_l0': 3, 'dropout_0': 0.16597039410549522, 'learning_rate': 0.09226668515809508, 'optimizer': 'SGD'}. Best is trial 1 with value: 0.47032725745981396.
[I 2023-09-19 01:17:35,273] Trial 2 finished with value: 0.5142117227749392 and parameters: {'n_layers': 2, 'n_units_l0': 10, 'dropout_0': 0.162629477794275, 'n_units_l1': 10, 'dropout_1': 0.2358469414954721, 'learning_rate': 0.08445482299849537, 'optimizer': 'Adam'}. Best is trial 1 with value: 0.47032725745981396.
[I 2023-09-19 01:19:03,864] Trial 3 finished with value: 0.4580100371891802 and parameters: {'n_layers': 1, 'n_units_l0': 7, 'dropout_0': 0.12042559129384292, 'learning_rate': 0.023152924698217645, 'optimizer': 'SGD'}. Best is trial 3 with value: 0.4580100371891802.
[I 2023-09-19 01:20:33,634] Trial 4 finished with value: 0.5062134169990365 and parameters: {'n_layers': 2, 'n_units_l0': 8, 'dropout_0': 0.20405104269877314, 'n_units_l1': 3, 'dropout_1': 0.2937490230966616, 'learning_rate': 0.013847709631097176, 'optimizer': 'SGD'}. Best is trial 3 with value: 0.4580100371891802.
[I 2023-09-19 01:20:35,527] Trial 5 pruned.
[I 2023-09-19 01:22:04,678] Trial 6 finished with value: 0.4366147118535909 and parameters: {'n_layers': 2, 'n_units_l0': 6, 'dropout_0': 0.12982196944332686, 'n_units_l1': 6, 'dropout_1': 0.152951249271163, 'learning_rate': 0.08809065120460717, 'optimizer': 'SGD'}. Best is trial 6 with value: 0.4366147118535909.
[I 2023-09-19 01:22:06,491] Trial 7 pruned.
[I 2023-09-19 01:22:08,332] Trial 8 pruned.
[I 2023-09-19 01:22:10,169] Trial 9 pruned.
Selected Catagories are:
['LPS_1.000_DMSO_0.025' 'LPS_10.000_DMSO_0.025']
The dimensions of the data are: (295923, 1270)
Number of total missing values across all columns: 591846
Data Subset Is Off
Wells held out for testing: ['D08' 'E08']
Wells to use for training, validation, and testing ['D02' 'E02' 'D03' 'E03' 'D09' 'E09']
Number of in features:  1245
Number of out features:  2
Binary_Classification
cpu
Validation Accuracy: 78.43956760786506
Validation Loss: 0.44165503867647865
Training Accuracy: 76.74520516031335
Training Loss: 0.46137712013582843
completed
