[NbConvertApp] WARNING | Config option `kernel_spec_manager_class` not recognized by `NbConvertApp`.
[NbConvertApp] Converting notebook ../notebooks/Hyperparameter_Optimization_model_binary.ipynb to script
[NbConvertApp] Writing 8579 bytes to Hyperparameter_Optimization_model_binary.py
cell_type: SHSY5Y control_name: LPS_100.000_DMSO_0.025 treatment_name: LPS_1.000_DMSO_0.025
[I 2023-09-19 01:14:57,622] A new study created in memory with name: no-name-7ad48eec-81e1-424a-a50e-8af00e6aea14
[I 2023-09-19 01:15:06,897] Trial 0 finished with value: 0.2596886796752612 and parameters: {'n_layers': 2, 'n_units_l0': 5, 'dropout_0': 0.13415472715708993, 'n_units_l1': 10, 'dropout_1': 0.11127449014098259, 'learning_rate': 0.04022149188479054, 'optimizer': 'SGD'}. Best is trial 0 with value: 0.2596886796752612.
[I 2023-09-19 01:15:16,282] Trial 1 finished with value: 0.39319823245207464 and parameters: {'n_layers': 2, 'n_units_l0': 3, 'dropout_0': 0.285141267964632, 'n_units_l1': 4, 'dropout_1': 0.26088020862110195, 'learning_rate': 0.013010400540599416, 'optimizer': 'RMSprop'}. Best is trial 0 with value: 0.2596886796752612.
[I 2023-09-19 01:15:25,611] Trial 2 finished with value: 0.24661929160356524 and parameters: {'n_layers': 2, 'n_units_l0': 7, 'dropout_0': 0.10767068692059596, 'n_units_l1': 4, 'dropout_1': 0.36728995763334094, 'learning_rate': 0.060125802792483536, 'optimizer': 'SGD'}. Best is trial 2 with value: 0.24661929160356524.
[I 2023-09-19 01:15:34,816] Trial 3 finished with value: 0.3380873641371727 and parameters: {'n_layers': 2, 'n_units_l0': 3, 'dropout_0': 0.2368816009301801, 'n_units_l1': 10, 'dropout_1': 0.3146147399732557, 'learning_rate': 0.027319937775737952, 'optimizer': 'SGD'}. Best is trial 2 with value: 0.24661929160356524.
[I 2023-09-19 01:15:44,076] Trial 4 finished with value: 0.29899754514296845 and parameters: {'n_layers': 3, 'n_units_l0': 8, 'dropout_0': 0.3752152454547901, 'n_units_l1': 4, 'dropout_1': 0.2037959202962636, 'n_units_l2': 8, 'dropout_2': 0.2726452447910207, 'learning_rate': 0.0765434423244077, 'optimizer': 'SGD'}. Best is trial 2 with value: 0.24661929160356524.
[I 2023-09-19 01:15:50,602] Trial 5 pruned.
[I 2023-09-19 01:15:50,938] Trial 6 pruned.
[I 2023-09-19 01:15:51,188] Trial 7 pruned.
[I 2023-09-19 01:15:51,354] Trial 8 pruned.
[I 2023-09-19 01:15:51,520] Trial 9 pruned.
Selected Catagories are:
['LPS_1.000_DMSO_0.025' 'LPS_100.000_DMSO_0.025']
The dimensions of the data are: (32445, 1276)
Number of total missing values across all columns: 64890
Data Subset Is Off
Wells held out for testing: ['D20' 'J16']
Wells to use for training, validation, and testing ['D16' 'D17' 'D21' 'J17' 'J20' 'J21']
Number of in features:  1251
Number of out features:  2
Binary_Classification
cpu
Validation Accuracy: 90.02398676592223
Validation Loss: 0.31109735816717143
Training Accuracy: 85.62198779604925
Training Loss: 0.36532964463531975
completed
