[NbConvertApp] WARNING | Config option `kernel_spec_manager_class` not recognized by `NbConvertApp`.
[NbConvertApp] Converting notebook ../notebooks/Hyperparameter_Optimization_model_binary.ipynb to script
[NbConvertApp] Writing 8579 bytes to Hyperparameter_Optimization_model_binary.py
cell_type: PBMC control_name: LPS_Nigericin_1.000_10.0_DMSO_0.025 treatment_name: LPS_Nigericin_1.000_3.0_DMSO_0.025
[I 2023-09-17 19:59:26,213] A new study created in memory with name: no-name-74dd4807-33a7-4fe6-9cdb-e6f8245dd923
[I 2023-09-17 20:01:48,277] Trial 0 finished with value: 0.6932221747296197 and parameters: {'n_layers': 2, 'n_units_l0': 10, 'dropout_0': 0.1681727454876597, 'n_units_l1': 3, 'dropout_1': 0.26428719587293154, 'learning_rate': 0.07491344247273388, 'optimizer': 'Adam'}. Best is trial 0 with value: 0.6932221747296197.
[I 2023-09-17 20:04:03,805] Trial 1 finished with value: 0.5845708962849209 and parameters: {'n_layers': 1, 'n_units_l0': 10, 'dropout_0': 0.23602667960113852, 'learning_rate': 0.009855029973418196, 'optimizer': 'Adam'}. Best is trial 1 with value: 0.5845708962849209.
[I 2023-09-17 20:06:12,478] Trial 2 finished with value: 0.6913801913602012 and parameters: {'n_layers': 1, 'n_units_l0': 6, 'dropout_0': 0.226164989562046, 'learning_rate': 0.09464751582770266, 'optimizer': 'Adam'}. Best is trial 1 with value: 0.5845708962849209.
[I 2023-09-17 20:08:26,582] Trial 3 finished with value: 0.6933392463411602 and parameters: {'n_layers': 2, 'n_units_l0': 4, 'dropout_0': 0.18430194435335415, 'n_units_l1': 9, 'dropout_1': 0.3731822146859288, 'learning_rate': 0.08219553900220751, 'optimizer': 'Adam'}. Best is trial 1 with value: 0.5845708962849209.
[I 2023-09-17 20:10:37,191] Trial 4 finished with value: 0.6082460787892342 and parameters: {'n_layers': 2, 'n_units_l0': 4, 'dropout_0': 0.1265307404271755, 'n_units_l1': 4, 'dropout_1': 0.2507915143643333, 'learning_rate': 0.007660237884076451, 'optimizer': 'RMSprop'}. Best is trial 1 with value: 0.5845708962849209.
[I 2023-09-17 20:10:42,551] Trial 5 pruned.
[I 2023-09-17 20:12:56,002] Trial 6 finished with value: 0.5994246016229902 and parameters: {'n_layers': 3, 'n_units_l0': 6, 'dropout_0': 0.16971481496250335, 'n_units_l1': 3, 'dropout_1': 0.17255196081049506, 'n_units_l2': 8, 'dropout_2': 0.1946902765623461, 'learning_rate': 0.01022826509582183, 'optimizer': 'Adam'}. Best is trial 1 with value: 0.5845708962849209.
[I 2023-09-17 20:12:58,477] Trial 7 pruned.
[I 2023-09-17 20:13:01,011] Trial 8 pruned.
[I 2023-09-17 20:13:03,777] Trial 9 pruned.
Selected Catagories are:
['LPS_Nigericin_1.000_3.0_DMSO_0.025'
 'LPS_Nigericin_1.000_10.0_DMSO_0.025']
The dimensions of the data are: (355427, 1270)
Number of total missing values across all columns: 0
Data Subset Is Off
Wells held out for testing: ['M08' 'L09']
Wells to use for training, validation, and testing ['L02' 'M02' 'L03' 'M03' 'L08' 'M09']
Number of in features:  1245
Number of out features:  2
Binary_Classification
cpu
Validation Accuracy: 68.45017182130583
Validation Loss: 0.5842000650508062
Training Accuracy: 67.16027345927814
Training Loss: 0.5902103074718283
completed
