[NbConvertApp] WARNING | Config option `kernel_spec_manager_class` not recognized by `NbConvertApp`.
[NbConvertApp] Converting notebook ../notebooks/Hyperparameter_Optimization_model_binary.ipynb to script
[NbConvertApp] Writing 8579 bytes to Hyperparameter_Optimization_model_binary.py
cell_type: SHSY5Y control_name: Flagellin_0.100_DMSO_0.025 treatment_name: LPS_0.100_DMSO_0.025
[I 2023-09-19 01:17:51,654] A new study created in memory with name: no-name-63ee52df-c3db-4109-aa9e-f9174961046c
[I 2023-09-19 01:18:00,356] Trial 0 finished with value: 0.650448541243871 and parameters: {'n_layers': 1, 'n_units_l0': 6, 'dropout_0': 0.31543199783045184, 'learning_rate': 0.03153304384716042, 'optimizer': 'RMSprop'}. Best is trial 0 with value: 0.650448541243871.
[I 2023-09-19 01:18:09,004] Trial 1 finished with value: 0.6130300279458364 and parameters: {'n_layers': 2, 'n_units_l0': 8, 'dropout_0': 0.2951497344860271, 'n_units_l1': 4, 'dropout_1': 0.38981652889422347, 'learning_rate': 0.047020768891730375, 'optimizer': 'SGD'}. Best is trial 1 with value: 0.6130300279458364.
[I 2023-09-19 01:18:17,986] Trial 2 finished with value: 0.6889960277080536 and parameters: {'n_layers': 3, 'n_units_l0': 9, 'dropout_0': 0.33739350782151345, 'n_units_l1': 8, 'dropout_1': 0.3445773892488373, 'n_units_l2': 2, 'dropout_2': 0.33593522463238396, 'learning_rate': 0.08071809466196933, 'optimizer': 'RMSprop'}. Best is trial 1 with value: 0.6130300279458364.
[I 2023-09-19 01:18:26,519] Trial 3 finished with value: 0.578430937329928 and parameters: {'n_layers': 2, 'n_units_l0': 5, 'dropout_0': 0.1302157895453015, 'n_units_l1': 3, 'dropout_1': 0.27233280920202246, 'learning_rate': 0.09598253684744328, 'optimizer': 'SGD'}. Best is trial 3 with value: 0.578430937329928.
[I 2023-09-19 01:18:35,181] Trial 4 finished with value: 0.6788164313634236 and parameters: {'n_layers': 2, 'n_units_l0': 5, 'dropout_0': 0.27133833740061647, 'n_units_l1': 5, 'dropout_1': 0.10415726968378997, 'learning_rate': 0.05830527798781596, 'optimizer': 'RMSprop'}. Best is trial 3 with value: 0.578430937329928.
[I 2023-09-19 01:18:43,896] Trial 5 finished with value: 0.5816162727276485 and parameters: {'n_layers': 1, 'n_units_l0': 6, 'dropout_0': 0.2050445145801705, 'learning_rate': 0.07240287913006932, 'optimizer': 'Adam'}. Best is trial 3 with value: 0.578430937329928.
[I 2023-09-19 01:18:45,097] Trial 6 pruned.
[I 2023-09-19 01:18:54,452] Trial 7 finished with value: 0.5172566004594167 and parameters: {'n_layers': 3, 'n_units_l0': 10, 'dropout_0': 0.22505527164674383, 'n_units_l1': 4, 'dropout_1': 0.2560565832001884, 'n_units_l2': 9, 'dropout_2': 0.26066107657712506, 'learning_rate': 0.011902209797036583, 'optimizer': 'Adam'}. Best is trial 7 with value: 0.5172566004594167.
[I 2023-09-19 01:19:02,996] Trial 8 finished with value: 0.5518865931034088 and parameters: {'n_layers': 1, 'n_units_l0': 2, 'dropout_0': 0.11401855492536421, 'learning_rate': 0.04068986425749468, 'optimizer': 'Adam'}. Best is trial 7 with value: 0.5172566004594167.
[I 2023-09-19 01:19:03,158] Trial 9 pruned.
Selected Catagories are:
['LPS_0.100_DMSO_0.025' 'Flagellin_0.100_DMSO_0.025']
The dimensions of the data are: (32438, 1276)
Number of total missing values across all columns: 64876
Data Subset Is Off
Wells held out for testing: ['C21' 'L22']
Wells to use for training, validation, and testing ['C16' 'C17' 'C20' 'L18' 'L19' 'L23']
Number of in features:  1251
Number of out features:  2
Binary_Classification
cpu
Validation Accuracy: 72.89579831932774
Validation Loss: 0.5360447059075039
Training Accuracy: 76.62813911947042
Training Loss: 0.46540189267694954
completed
