[NbConvertApp] WARNING | Config option `kernel_spec_manager_class` not recognized by `NbConvertApp`.
[NbConvertApp] Converting notebook ../notebooks/Hyperparameter_Optimization_model_binary.ipynb to script
[NbConvertApp] Writing 8579 bytes to Hyperparameter_Optimization_model_binary.py
cell_type: PBMC control_name: Thapsigargin_1.000_DMSO_0.025 treatment_name: Thapsigargin_10.000_DMSO_0.025
[I 2023-09-19 01:29:40,399] A new study created in memory with name: no-name-3336ecc5-9a53-41e4-abca-d72060adb640
[I 2023-09-19 01:31:11,175] Trial 0 finished with value: 0.4799750534196695 and parameters: {'n_layers': 1, 'n_units_l0': 8, 'dropout_0': 0.14808977889334593, 'learning_rate': 0.004008729858948943, 'optimizer': 'SGD'}. Best is trial 0 with value: 0.4799750534196695.
[I 2023-09-19 01:32:42,554] Trial 1 finished with value: 0.3079078409075737 and parameters: {'n_layers': 1, 'n_units_l0': 10, 'dropout_0': 0.21237011321688934, 'learning_rate': 0.029724029454174995, 'optimizer': 'SGD'}. Best is trial 1 with value: 0.3079078409075737.
[I 2023-09-19 01:34:15,142] Trial 2 finished with value: 0.30897467069327833 and parameters: {'n_layers': 1, 'n_units_l0': 4, 'dropout_0': 0.14479614361442145, 'learning_rate': 0.0808009330299374, 'optimizer': 'Adam'}. Best is trial 1 with value: 0.3079078409075737.
[I 2023-09-19 01:35:47,829] Trial 3 finished with value: 0.26311901173243923 and parameters: {'n_layers': 1, 'n_units_l0': 10, 'dropout_0': 0.17526604504332832, 'learning_rate': 0.060779275276573154, 'optimizer': 'Adam'}. Best is trial 3 with value: 0.26311901173243923.
[I 2023-09-19 01:37:20,962] Trial 4 finished with value: 0.5257182414084673 and parameters: {'n_layers': 3, 'n_units_l0': 2, 'dropout_0': 0.20531539103986143, 'n_units_l1': 6, 'dropout_1': 0.3469407535999835, 'n_units_l2': 8, 'dropout_2': 0.19219125726284386, 'learning_rate': 0.0712364064307329, 'optimizer': 'SGD'}. Best is trial 3 with value: 0.26311901173243923.
[I 2023-09-19 01:38:16,842] Trial 5 pruned.
[I 2023-09-19 01:38:18,752] Trial 6 pruned.
[I 2023-09-19 01:38:20,532] Trial 7 pruned.
[I 2023-09-19 01:38:22,317] Trial 8 pruned.
[I 2023-09-19 01:39:53,877] Trial 9 finished with value: 0.2523286184544365 and parameters: {'n_layers': 1, 'n_units_l0': 10, 'dropout_0': 0.12838847953035448, 'learning_rate': 0.015948760016489934, 'optimizer': 'RMSprop'}. Best is trial 9 with value: 0.2523286184544365.
Selected Catagories are:
['Thapsigargin_1.000_DMSO_0.025' 'Thapsigargin_10.000_DMSO_0.025']
The dimensions of the data are: (315440, 1270)
Number of total missing values across all columns: 630880
Data Subset Is Off
Wells held out for testing: ['K06' 'L06']
Wells to use for training, validation, and testing ['D06' 'E06' 'D07' 'E07' 'K07' 'L07']
Number of in features:  1245
Number of out features:  2
Binary_Classification
cpu
Validation Accuracy: 88.95185185185186
Validation Loss: 0.2580732102195422
Training Accuracy: 87.77309653141539
Training Loss: 0.2781998371244759
completed
