[NbConvertApp] WARNING | Config option `kernel_spec_manager_class` not recognized by `NbConvertApp`.
[NbConvertApp] Converting notebook ../notebooks/Hyperparameter_Optimization_model_binary.ipynb to script
[NbConvertApp] Writing 8579 bytes to Hyperparameter_Optimization_model_binary.py
cell_type: PBMC control_name: LPS_Nigericin_1.000_3.0_DMSO_0.025 treatment_name: LPS_10.000_DMSO_0.025
[I 2023-09-19 01:12:46,762] A new study created in memory with name: no-name-d512de83-4fde-4ea3-9006-fb9b0711fd4c
[I 2023-09-19 01:14:35,454] Trial 0 finished with value: 0.08899553218999735 and parameters: {'n_layers': 2, 'n_units_l0': 5, 'dropout_0': 0.15565821368910426, 'n_units_l1': 5, 'dropout_1': 0.13752050634368657, 'learning_rate': 0.002519608004324413, 'optimizer': 'Adam'}. Best is trial 0 with value: 0.08899553218999735.
[I 2023-09-19 01:16:24,441] Trial 1 finished with value: 0.13838915054041606 and parameters: {'n_layers': 3, 'n_units_l0': 5, 'dropout_0': 0.18053746182373975, 'n_units_l1': 3, 'dropout_1': 0.23619751557062435, 'n_units_l2': 10, 'dropout_2': 0.375439519733359, 'learning_rate': 0.08650028669161892, 'optimizer': 'SGD'}. Best is trial 0 with value: 0.08899553218999735.
[I 2023-09-19 01:18:11,723] Trial 2 finished with value: 0.14325483152499566 and parameters: {'n_layers': 1, 'n_units_l0': 9, 'dropout_0': 0.38415561978911206, 'learning_rate': 0.039418841129193985, 'optimizer': 'RMSprop'}. Best is trial 0 with value: 0.08899553218999735.
[I 2023-09-19 01:20:03,765] Trial 3 finished with value: 0.6619279202360373 and parameters: {'n_layers': 3, 'n_units_l0': 4, 'dropout_0': 0.1523390270808891, 'n_units_l1': 10, 'dropout_1': 0.10835724590202217, 'n_units_l2': 4, 'dropout_2': 0.31357596114904207, 'learning_rate': 0.0962739810704952, 'optimizer': 'RMSprop'}. Best is trial 0 with value: 0.08899553218999735.
[I 2023-09-19 01:21:51,933] Trial 4 finished with value: 0.14183202666731984 and parameters: {'n_layers': 2, 'n_units_l0': 3, 'dropout_0': 0.3379897318655932, 'n_units_l1': 8, 'dropout_1': 0.2705739605201719, 'learning_rate': 0.01875722946727817, 'optimizer': 'SGD'}. Best is trial 0 with value: 0.08899553218999735.
[I 2023-09-19 01:21:54,073] Trial 5 pruned.
[I 2023-09-19 01:23:40,213] Trial 6 finished with value: 0.09491793599266271 and parameters: {'n_layers': 1, 'n_units_l0': 5, 'dropout_0': 0.18528012483958517, 'learning_rate': 0.013882459463461108, 'optimizer': 'RMSprop'}. Best is trial 0 with value: 0.08899553218999735.
[I 2023-09-19 01:25:27,995] Trial 7 finished with value: 0.08763025775551796 and parameters: {'n_layers': 1, 'n_units_l0': 7, 'dropout_0': 0.24492428534409058, 'learning_rate': 0.08881091042883979, 'optimizer': 'SGD'}. Best is trial 7 with value: 0.08763025775551796.
[I 2023-09-19 01:25:30,264] Trial 8 pruned.
[I 2023-09-19 01:27:19,014] Trial 9 finished with value: 0.12315927355335309 and parameters: {'n_layers': 1, 'n_units_l0': 4, 'dropout_0': 0.27952621758932344, 'learning_rate': 0.06047332193809543, 'optimizer': 'Adam'}. Best is trial 7 with value: 0.08763025775551796.
Selected Catagories are:
['LPS_10.000_DMSO_0.025' 'LPS_Nigericin_1.000_3.0_DMSO_0.025']
The dimensions of the data are: (330751, 1270)
Number of total missing values across all columns: 312980
Data Subset Is Off
Wells held out for testing: ['E09' 'L09']
Wells to use for training, validation, and testing ['E02' 'E03' 'E08' 'L02' 'L03' 'L08']
Number of in features:  1245
Number of out features:  2
Binary_Classification
cpu
Validation Accuracy: 96.73276136002542
Validation Loss: 0.08838343920616003
Training Accuracy: 95.62528487941965
Training Loss: 0.10803151645024518
completed
