[NbConvertApp] WARNING | Config option `kernel_spec_manager_class` not recognized by `NbConvertApp`.
[NbConvertApp] Converting notebook ../notebooks/Hyperparameter_Optimization_model_binary.ipynb to script
[NbConvertApp] Writing 8579 bytes to Hyperparameter_Optimization_model_binary.py
cell_type: SHSY5Y control_name: LPS_Nigericin_1.000_10.0_DMSO_0.025 treatment_name: LPS_Nigericin_1.000_1.0_DMSO_0.025
[I 2023-09-19 00:51:16,130] A new study created in memory with name: no-name-95d510a2-a28b-4867-b7d9-25db6bb6377a
[I 2023-09-19 00:51:25,592] Trial 0 finished with value: 0.19313900291919706 and parameters: {'n_layers': 1, 'n_units_l0': 8, 'dropout_0': 0.20895519400416002, 'learning_rate': 0.0018746569377555188, 'optimizer': 'Adam'}. Best is trial 0 with value: 0.19313900291919706.
[I 2023-09-19 00:51:34,493] Trial 1 finished with value: 0.40494739025831217 and parameters: {'n_layers': 3, 'n_units_l0': 6, 'dropout_0': 0.2218991698606328, 'n_units_l1': 10, 'dropout_1': 0.3977571502085969, 'n_units_l2': 7, 'dropout_2': 0.2943659115317673, 'learning_rate': 0.029200701669157284, 'optimizer': 'RMSprop'}. Best is trial 0 with value: 0.19313900291919706.
[I 2023-09-19 00:51:42,959] Trial 2 finished with value: 0.2422217031319936 and parameters: {'n_layers': 1, 'n_units_l0': 4, 'dropout_0': 0.23162698036439625, 'learning_rate': 0.01374497330545581, 'optimizer': 'RMSprop'}. Best is trial 0 with value: 0.19313900291919706.
[I 2023-09-19 00:51:51,579] Trial 3 finished with value: 0.33771282633145644 and parameters: {'n_layers': 1, 'n_units_l0': 7, 'dropout_0': 0.38611491972015743, 'learning_rate': 0.047065424360285116, 'optimizer': 'RMSprop'}. Best is trial 0 with value: 0.19313900291919706.
[I 2023-09-19 00:52:00,517] Trial 4 finished with value: 0.5519579521814982 and parameters: {'n_layers': 3, 'n_units_l0': 10, 'dropout_0': 0.3594026975528476, 'n_units_l1': 3, 'dropout_1': 0.10019319288379051, 'n_units_l2': 3, 'dropout_2': 0.31110442415345374, 'learning_rate': 0.030545282998314882, 'optimizer': 'RMSprop'}. Best is trial 0 with value: 0.19313900291919706.
[I 2023-09-19 00:52:09,063] Trial 5 finished with value: 0.2560067790746689 and parameters: {'n_layers': 2, 'n_units_l0': 2, 'dropout_0': 0.39325432596336274, 'n_units_l1': 3, 'dropout_1': 0.18878558559696051, 'learning_rate': 0.05335887858373481, 'optimizer': 'Adam'}. Best is trial 0 with value: 0.19313900291919706.
[I 2023-09-19 00:52:17,668] Trial 6 finished with value: 0.2393785429994265 and parameters: {'n_layers': 1, 'n_units_l0': 7, 'dropout_0': 0.13195418780628337, 'learning_rate': 0.023825421182970895, 'optimizer': 'Adam'}. Best is trial 0 with value: 0.19313900291919706.
[I 2023-09-19 00:52:26,596] Trial 7 finished with value: 0.24491600861152013 and parameters: {'n_layers': 3, 'n_units_l0': 6, 'dropout_0': 0.3202224649541825, 'n_units_l1': 10, 'dropout_1': 0.3067905339628222, 'n_units_l2': 10, 'dropout_2': 0.31599392721779207, 'learning_rate': 0.003012966433720422, 'optimizer': 'RMSprop'}. Best is trial 0 with value: 0.19313900291919706.
[I 2023-09-19 00:52:26,758] Trial 8 pruned.
[I 2023-09-19 00:52:26,919] Trial 9 pruned.
Selected Catagories are:
['LPS_Nigericin_1.000_1.0_DMSO_0.025'
 'LPS_Nigericin_1.000_10.0_DMSO_0.025']
The dimensions of the data are: (30620, 1276)
Number of total missing values across all columns: 0
Data Subset Is Off
Wells held out for testing: ['M16' 'K20']
Wells to use for training, validation, and testing ['K16' 'K17' 'M17' 'M20' 'K21' 'M21']
Number of in features:  1251
Number of out features:  2
Binary_Classification
cpu
Validation Accuracy: 91.98067632850241
Validation Loss: 0.2104973378777504
Training Accuracy: 93.91786537828044
Training Loss: 0.1838822039373611
completed
