[NbConvertApp] WARNING | Config option `kernel_spec_manager_class` not recognized by `NbConvertApp`.
[NbConvertApp] Converting notebook ../notebooks/Hyperparameter_Optimization_model_binary.ipynb to script
[NbConvertApp] Writing 8579 bytes to Hyperparameter_Optimization_model_binary.py
cell_type: SHSY5Y control_name: LPS_Nigericin_1.000_1.0_DMSO_0.025 treatment_name: LPS_100.000_DMSO_0.025
[I 2023-09-17 20:09:13,983] A new study created in memory with name: no-name-21a59fab-5dc9-4d3a-9bc4-fd3a477edcfb
[I 2023-09-17 20:09:22,932] Trial 0 finished with value: 0.6596533262729645 and parameters: {'n_layers': 3, 'n_units_l0': 5, 'dropout_0': 0.3319038452614862, 'n_units_l1': 2, 'dropout_1': 0.3085564186854963, 'n_units_l2': 10, 'dropout_2': 0.3905396098344863, 'learning_rate': 0.0887074354806622, 'optimizer': 'Adam'}. Best is trial 0 with value: 0.6596533262729645.
[I 2023-09-17 20:09:31,112] Trial 1 finished with value: 0.13373895540833472 and parameters: {'n_layers': 1, 'n_units_l0': 3, 'dropout_0': 0.18246355251445778, 'learning_rate': 0.016746240824824492, 'optimizer': 'Adam'}. Best is trial 1 with value: 0.13373895540833472.
[I 2023-09-17 20:09:38,964] Trial 2 finished with value: 0.09957602985203266 and parameters: {'n_layers': 1, 'n_units_l0': 3, 'dropout_0': 0.3516584942214058, 'learning_rate': 0.005056403310528466, 'optimizer': 'Adam'}. Best is trial 2 with value: 0.09957602985203266.
[I 2023-09-17 20:09:47,023] Trial 3 finished with value: 0.6922541487216948 and parameters: {'n_layers': 3, 'n_units_l0': 2, 'dropout_0': 0.14795197906566082, 'n_units_l1': 5, 'dropout_1': 0.2436995565916181, 'n_units_l2': 9, 'dropout_2': 0.3714276818257979, 'learning_rate': 0.004330117545307083, 'optimizer': 'SGD'}. Best is trial 2 with value: 0.09957602985203266.
[I 2023-09-17 20:09:55,304] Trial 4 finished with value: 0.6916223311424257 and parameters: {'n_layers': 3, 'n_units_l0': 8, 'dropout_0': 0.14317456588878075, 'n_units_l1': 4, 'dropout_1': 0.319290309240919, 'n_units_l2': 3, 'dropout_2': 0.30529704716458034, 'learning_rate': 0.0769343818932566, 'optimizer': 'RMSprop'}. Best is trial 2 with value: 0.09957602985203266.
[I 2023-09-17 20:09:55,457] Trial 5 pruned.
[I 2023-09-17 20:09:55,610] Trial 6 pruned.
[I 2023-09-17 20:10:03,618] Trial 7 finished with value: 0.17533093482255935 and parameters: {'n_layers': 3, 'n_units_l0': 4, 'dropout_0': 0.23190988185566247, 'n_units_l1': 7, 'dropout_1': 0.17569159989020353, 'n_units_l2': 8, 'dropout_2': 0.36817132070321523, 'learning_rate': 0.07554535338598495, 'optimizer': 'SGD'}. Best is trial 2 with value: 0.09957602985203266.
[I 2023-09-17 20:10:11,752] Trial 8 finished with value: 0.30652261952559157 and parameters: {'n_layers': 2, 'n_units_l0': 8, 'dropout_0': 0.18235024283473952, 'n_units_l1': 2, 'dropout_1': 0.29748719769057536, 'learning_rate': 0.09051002354996943, 'optimizer': 'RMSprop'}. Best is trial 2 with value: 0.09957602985203266.
[I 2023-09-17 20:10:11,900] Trial 9 pruned.
Selected Catagories are:
['LPS_100.000_DMSO_0.025' 'LPS_Nigericin_1.000_1.0_DMSO_0.025']
The dimensions of the data are: (32205, 1276)
Number of total missing values across all columns: 31974
Data Subset Is Off
Wells held out for testing: ['K16' 'J20']
Wells to use for training, validation, and testing ['J16' 'J17' 'K17' 'K20' 'J21' 'K21']
Number of in features:  1251
Number of out features:  2
Binary_Classification
cpu
Validation Accuracy: 97.33880229696472
Validation Loss: 0.10724640265107155
Training Accuracy: 91.69162905211326
Training Loss: 0.18244290482252837
completed
