[NbConvertApp] WARNING | Config option `kernel_spec_manager_class` not recognized by `NbConvertApp`.
[NbConvertApp] Converting notebook ../notebooks/Hyperparameter_Optimization_model_binary.ipynb to script
[NbConvertApp] Writing 8579 bytes to Hyperparameter_Optimization_model_binary.py
cell_type: PBMC control_name: Thapsigargin_1.000_DMSO_0.025 treatment_name: Flagellin_1.000_DMSO_0.025
[I 2023-09-19 00:46:39,856] A new study created in memory with name: no-name-bbbd6759-832f-42f3-822e-90b7dd699346
[I 2023-09-19 00:47:53,659] Trial 0 finished with value: 3.8631716858713245 and parameters: {'n_layers': 1, 'n_units_l0': 7, 'dropout_0': 0.2719538464171034, 'learning_rate': 0.0958369863009116, 'optimizer': 'RMSprop'}. Best is trial 0 with value: 3.8631716858713245.
[I 2023-09-19 00:49:07,877] Trial 1 finished with value: 0.5319222992344906 and parameters: {'n_layers': 3, 'n_units_l0': 4, 'dropout_0': 0.24055964159644194, 'n_units_l1': 2, 'dropout_1': 0.38252049660438425, 'n_units_l2': 10, 'dropout_2': 0.3198324172852744, 'learning_rate': 0.03785685209366664, 'optimizer': 'SGD'}. Best is trial 1 with value: 0.5319222992344906.
[I 2023-09-19 00:50:25,454] Trial 2 finished with value: 0.639342934771588 and parameters: {'n_layers': 3, 'n_units_l0': 7, 'dropout_0': 0.13014043353673244, 'n_units_l1': 9, 'dropout_1': 0.1733499667275369, 'n_units_l2': 10, 'dropout_2': 0.3875072002300518, 'learning_rate': 0.042622852903818814, 'optimizer': 'RMSprop'}. Best is trial 1 with value: 0.5319222992344906.
[I 2023-09-19 00:51:40,379] Trial 3 finished with value: 0.5079021176852678 and parameters: {'n_layers': 3, 'n_units_l0': 5, 'dropout_0': 0.13044212975774294, 'n_units_l1': 3, 'dropout_1': 0.13576393964806735, 'n_units_l2': 3, 'dropout_2': 0.15757150535358652, 'learning_rate': 0.04729408202993399, 'optimizer': 'RMSprop'}. Best is trial 3 with value: 0.5079021176852678.
[I 2023-09-19 00:52:53,971] Trial 4 finished with value: 0.3984422257385755 and parameters: {'n_layers': 2, 'n_units_l0': 5, 'dropout_0': 0.19229267781410658, 'n_units_l1': 6, 'dropout_1': 0.12978811303065488, 'learning_rate': 0.08171685758732132, 'optimizer': 'SGD'}. Best is trial 4 with value: 0.3984422257385755.
[I 2023-09-19 00:52:55,470] Trial 5 pruned.
[I 2023-09-19 00:52:56,914] Trial 6 pruned.
[I 2023-09-19 00:54:01,221] Trial 7 pruned.
[I 2023-09-19 00:55:13,231] Trial 8 finished with value: 0.4172758734696791 and parameters: {'n_layers': 1, 'n_units_l0': 4, 'dropout_0': 0.13352661514193992, 'learning_rate': 0.01892374313625944, 'optimizer': 'RMSprop'}. Best is trial 4 with value: 0.3984422257385755.
[I 2023-09-19 00:55:40,877] Trial 9 pruned.
Selected Catagories are:
['Thapsigargin_1.000_DMSO_0.025' 'Flagellin_1.000_DMSO_0.025']
The dimensions of the data are: (253003, 1270)
Number of total missing values across all columns: 542622
Data Subset Is Off
Wells held out for testing: ['K07' 'M10']
Wells to use for training, validation, and testing ['D06' 'D07' 'K06' 'M05' 'M11']
Number of in features:  1245
Number of out features:  2
Binary_Classification
cpu
Validation Accuracy: 78.72017762975298
Validation Loss: 0.4332339779013082
Training Accuracy: 80.19233384681571
Training Loss: 0.41807526499649567
completed
