[NbConvertApp] WARNING | Config option `kernel_spec_manager_class` not recognized by `NbConvertApp`.
[NbConvertApp] Converting notebook ../notebooks/Hyperparameter_Optimization_model_binary.ipynb to script
[NbConvertApp] Writing 8579 bytes to Hyperparameter_Optimization_model_binary.py
cell_type: SHSY5Y control_name: H2O2_100.000_DMSO_0.025 treatment_name: Flagellin_1.000_DMSO_0.025
[I 2023-09-19 00:47:06,451] A new study created in memory with name: no-name-ed5dc5a5-26ef-4f01-acc8-40ff38bf766d
[I 2023-09-19 00:47:21,127] Trial 0 finished with value: 0.44331661134958267 and parameters: {'n_layers': 1, 'n_units_l0': 2, 'dropout_0': 0.29910797663449273, 'learning_rate': 0.06774484468961865, 'optimizer': 'Adam'}. Best is trial 0 with value: 0.44331661134958267.
[I 2023-09-19 00:47:35,676] Trial 1 finished with value: 0.4205064396560192 and parameters: {'n_layers': 2, 'n_units_l0': 5, 'dropout_0': 0.36702421080929515, 'n_units_l1': 10, 'dropout_1': 0.16667639601735046, 'learning_rate': 0.02491706038723312, 'optimizer': 'RMSprop'}. Best is trial 1 with value: 0.4205064396560192.
[I 2023-09-19 00:47:50,588] Trial 2 finished with value: 0.5568142679333686 and parameters: {'n_layers': 2, 'n_units_l0': 6, 'dropout_0': 0.1426688801746155, 'n_units_l1': 7, 'dropout_1': 0.13113274631525662, 'learning_rate': 0.09083608182440694, 'optimizer': 'RMSprop'}. Best is trial 1 with value: 0.4205064396560192.
[I 2023-09-19 00:48:05,436] Trial 3 finished with value: 0.4115426929295063 and parameters: {'n_layers': 2, 'n_units_l0': 10, 'dropout_0': 0.22819741359879675, 'n_units_l1': 8, 'dropout_1': 0.3422498715769996, 'learning_rate': 0.0122617772972675, 'optimizer': 'RMSprop'}. Best is trial 3 with value: 0.4115426929295063.
[I 2023-09-19 00:48:20,724] Trial 4 finished with value: 0.39239361077547075 and parameters: {'n_layers': 3, 'n_units_l0': 9, 'dropout_0': 0.3599866585231657, 'n_units_l1': 3, 'dropout_1': 0.3073443020432709, 'n_units_l2': 6, 'dropout_2': 0.3355732670884106, 'learning_rate': 0.007205150582948616, 'optimizer': 'Adam'}. Best is trial 4 with value: 0.39239361077547075.
[I 2023-09-19 00:48:21,065] Trial 5 pruned.
[I 2023-09-19 00:48:21,331] Trial 6 pruned.
[I 2023-09-19 00:48:32,745] Trial 7 pruned.
[I 2023-09-19 00:48:33,014] Trial 8 pruned.
[I 2023-09-19 00:48:33,649] Trial 9 pruned.
Selected Catagories are:
['H2O2_100.000_DMSO_0.025' 'Flagellin_1.000_DMSO_0.025']
The dimensions of the data are: (42709, 1276)
Number of total missing values across all columns: 85418
Data Subset Is Off
Wells held out for testing: ['I22' 'M22']
Wells to use for training, validation, and testing ['H18' 'H19' 'H22' 'H23' 'I18' 'M18' 'I19' 'M19' 'I23' 'M23']
Number of in features:  1251
Number of out features:  2
Binary_Classification
cpu
Validation Accuracy: 81.10856183547845
Validation Loss: 0.4118629755079746
Training Accuracy: 79.75436387168993
Training Loss: 0.430638670366386
completed
