[NbConvertApp] WARNING | Config option `kernel_spec_manager_class` not recognized by `NbConvertApp`.
[NbConvertApp] Converting notebook ../notebooks/Hyperparameter_Optimization_model_binary.ipynb to script
[NbConvertApp] Writing 8579 bytes to Hyperparameter_Optimization_model_binary.py
cell_type: SHSY5Y control_name: LPS_0.010_DMSO_0.025 treatment_name: LPS_0.010_DMSO_0.025
[I 2023-09-19 01:23:50,330] A new study created in memory with name: no-name-ee40d289-2419-4c14-ae3d-a9be755eec38
[I 2023-09-19 01:23:55,382] Trial 0 finished with value: 9.91970768882311e-05 and parameters: {'n_layers': 3, 'n_units_l0': 4, 'dropout_0': 0.2806124006848025, 'n_units_l1': 8, 'dropout_1': 0.10508949003300871, 'n_units_l2': 4, 'dropout_2': 0.34168485383740443, 'learning_rate': 0.06672785110758515, 'optimizer': 'SGD'}. Best is trial 0 with value: 9.91970768882311e-05.
[I 2023-09-19 01:24:00,163] Trial 1 finished with value: 0.004076626357173155 and parameters: {'n_layers': 2, 'n_units_l0': 6, 'dropout_0': 0.37872671330528496, 'n_units_l1': 7, 'dropout_1': 0.39626779579394755, 'learning_rate': 0.0012541207402435959, 'optimizer': 'RMSprop'}. Best is trial 0 with value: 9.91970768882311e-05.
[I 2023-09-19 01:24:04,885] Trial 2 finished with value: 0.02561857996333856 and parameters: {'n_layers': 3, 'n_units_l0': 9, 'dropout_0': 0.24628701682810025, 'n_units_l1': 5, 'dropout_1': 0.28501482343630336, 'n_units_l2': 2, 'dropout_2': 0.14007778536398618, 'learning_rate': 0.003134563524280573, 'optimizer': 'SGD'}. Best is trial 0 with value: 9.91970768882311e-05.
[I 2023-09-19 01:24:09,574] Trial 3 finished with value: 0.005197923020459711 and parameters: {'n_layers': 1, 'n_units_l0': 4, 'dropout_0': 0.26698703679321184, 'learning_rate': 0.018712807878287795, 'optimizer': 'SGD'}. Best is trial 0 with value: 9.91970768882311e-05.
[I 2023-09-19 01:24:14,287] Trial 4 finished with value: 0.05518153908284536 and parameters: {'n_layers': 1, 'n_units_l0': 10, 'dropout_0': 0.36106895844568687, 'learning_rate': 0.048663030948149194, 'optimizer': 'Adam'}. Best is trial 0 with value: 9.91970768882311e-05.
[I 2023-09-19 01:24:14,378] Trial 5 pruned.
[I 2023-09-19 01:24:19,207] Trial 6 finished with value: 0.0006850832689337949 and parameters: {'n_layers': 2, 'n_units_l0': 10, 'dropout_0': 0.23910448754236932, 'n_units_l1': 6, 'dropout_1': 0.32560858539780335, 'learning_rate': 0.002067094551344994, 'optimizer': 'Adam'}. Best is trial 0 with value: 9.91970768882311e-05.
[I 2023-09-19 01:24:19,298] Trial 7 pruned.
[I 2023-09-19 01:24:19,389] Trial 8 pruned.
[I 2023-09-19 01:24:19,557] Trial 9 pruned.
Selected Catagories are:
['LPS_0.010_DMSO_0.025']
The dimensions of the data are: (15859, 1276)
Number of total missing values across all columns: 31718
Data Subset Is Off
Wells held out for testing: ['B20']
Wells to use for training, validation, and testing ['B16' 'B17' 'B21']
Number of in features:  1251
Number of out features:  1
Regression
cpu
Validation Loss: 0.00018863882403820752
Training Loss: 0.0017962249383854211
completed
